Restaurant,Reviewer,Review,Rating,Metadata,Time,Pictures,7514
AB's - Absolute Barbecues,Karthik,Shantanu Ali and team given me a great experience for my 1st time experience in AB's. I suggest my friends to visit and I refer you all who read this approach them for your great experience.,5,"3 Reviews , 5 Followers",5/10/2019 23:30,0,
AB's - Absolute Barbecues,Taurus King (aasif666),Shantanu Ali did excellent and awesome service please visit and request his service keep up the good service and treat everyone as good as possible like this,5,"1 Review , 4 Followers",5/10/2019 23:28,0,
AB's - Absolute Barbecues,Vinod Kumar,Best Place to Hangout...Rahamat and Bahadur has served is with very good we are very happy to there service also again visiting soon love abs ..........................,5,"1 Review , 3 Followers",5/10/2019 22:55,0,
AB's - Absolute Barbecues,Nayanika Biswas,"I was here for my B-Day occasion.. It was good good and the waiters was so friendly..

I loved it, last time in anniversary I was here. It was such lovely hence revisited 😍

Do visit here for sure... Very tasty food, deserts was tasty.

Excellent food amazing ambience and most importantly fantastic service by all the people",5,"2 Reviews , 44 Followers",5/9/2019 23:15,3,
AB's - Absolute Barbecues,Binny Sean,"foood was very tasty and very goos service.would love to appreciate the service by Surajit ,IIjual and mahali...well done guys...Keep it up...",5,"1 Review , 29 Followers",5/9/2019 23:11,0,
AB's - Absolute Barbecues,Khaleel Km,Very nice food and excellent service and hospitality specially by Rehmat. The grills and deserts were excellent specially pan ice cream.....,5,"1 Review , 3 Followers",5/9/2019 20:28,0,
AB's - Absolute Barbecues,Ramakrishna Reddy,"Excellent food and excellent service providing by Mr bahadur vrahamat and ripen we are fully happy there service also again visit soon love and ,,,,,,,,,,,",5,"1 Review , 2 Followers",5/9/2019 15:59,0,
AB's - Absolute Barbecues,Santhosh,"Been to this place for the first time.
Absolutely loved the experience and service.
Would come back here again everytime I visit Hyderabad. A must try!",5,"1 Review , 3 Followers",5/9/2019 14:11,0,
AB's - Absolute Barbecues,Raja Narra,I love the food and service mr chef Pankaj and bhadur give excellent excprince today I like the most crispy corn and chef special mutone and paan shot ice cream 👌👍👌👌👌,5,"1 Review , 2 Followers",5/9/2019 14:01,0,
AB's - Absolute Barbecues,Aditya Ravi,"Waiter: Bahadur, very well spoken and serves fast.
Rahmath, Ripun - good job 👍🏻we are very happy there's service also lovely pic again visit soon love abs ,,,,,,,,,,,",5,"2 Reviews , 2 Followers",5/9/2019 13:37,0,
AB's - Absolute Barbecues,Yashwanth Chinnu,Good food and ambiance one should definitely visit this place.especially service provided by them is awesome. Even nandan is cool guys.try egg pellets therw,5,"1 Review , 40 Followers",5/9/2019 13:32,0,
AB's - Absolute Barbecues,AKHIL BONDADA,"Food is pretty good here and the service is just awesome... You cannot
experience this kind of service anywhere.. It is that good. Food made by Chef pankaj is excellent.",5,"1 Review , 1 Follower",5/9/2019 13:29,0,
AB's - Absolute Barbecues,Tadi Rama Chandra Reddy,Very nice food very service very good staff and very good staters and deserts and staff is politely and very nice place and good staff name shekhar and mantu sarvice is nice,5,"1 Review , 26 Followers",5/8/2019 16:10,0,
AB's - Absolute Barbecues,Pradeep Neerudi,V good service And food is nice and very great service and and staff is good and very nice and polityly and very good food and staff is good staff name shekhar and mount very good,5,"1 Review , 2 Followers",5/7/2019 22:44,0,
AB's - Absolute Barbecues,Brijesh Kumar,Very nice food and good staters very nice staff good service and so many types of staters and bufect and daserts very nice and staff name shekhar and mount sarvice nice,5,"1 Review , 3 Followers",5/7/2019 22:40,0,
