Restaurant,Reviewer,Review,Rating,Metadata,Time,Pictures,7514
Barbeque Nation,Rabia Sultana,"I almost forgot to write the review as I got too busy until I found these pictures in my gallery. I was here for a lunch with my colleagues last month. What a bad day it was. When you have already been to the place and have a nice set of expectations from the food. First of all, the presence of foreign particles in food questions the level of hygiene inside the kitchen. I was probably too lucky that day to have two such instances. I politely asked to replace the drink that was served. But things got too much for me when I found a hair in the crispy corn. When I put this into light to the serving staff, they just tried to take away the plate and all I got to listen was they will replace it. That’s what drove me mad. When I demanded to see the manager, he apologized and asked for the plate replacement. But I was done with the food now. No more nonsense. At the end, the manager showed up with a specially made choco-vanilla dessert(in pic).
Not just the hygiene, but the service was bad too. The team was all the time waiting for them to get the food. The overall experience was bad, something not expected from a BBQ Nation.",2,"10 Reviews , 2 Followers",10/9/2018 21:06,2,
Barbeque Nation,Prachita Jayaswal,"This place goes and keeps up with the name! Amazing starters. The chicken kebabs are wonderful. The crispy corn and the Cajun spice potatoes are super duper awesome!! After the rounds of starters,. There wasn't any space for the main course so directly went for desserts. Their in house kulfis are the speciality here. Paan kulfi tastes the best! Gulab jamuns with ice-cream make the perfect combo.",4,"104 Reviews , 531 Followers",9/28/2018 1:27,8,
Barbeque Nation,Fashion Shadz,"Awesome food and awesome Service.Specially by Mr. Gopal who was awesome with his services .
Keep it up and Thumbs up for Barbeque nation , Gachibowli.
My birthday went awesome",5,1 Review,9/26/2018 22:37,0,
Barbeque Nation,Krishna Giri,"Food quality has degraded than before.
Ice tea served was more proportion of water . Ice tea flavour was not there at all. Partha served over the counter was pathetic. It was having very bad quality of oil not even ghee. Very much upset with the food quality this time.",2,"4 Reviews , 34 Followers",9/19/2018 20:30,0,
Barbeque Nation,Satyanarayana Murty Karra,"Awesome place !!!

1. Good ambiance,
2. Great food ( Veg)
3. Chef always comes to your table to know if we are enjoying the starters and any improvement is needed or any special starter that we prefer etc.,


My kid loves this place and we have been there multiple times and still don't get bored.",4,"4 Reviews , 1 Follower",9/17/2018 15:07,0,
Barbeque Nation,Epicurean Palette,"And of course the best place to celebrate your special occasions. Beautiful place to dine with your friends and family. Perfect ambiance. Delicious food. A sweet gesture of cake from the restaurant itself and song by the staff, making it more special. And the varieties of kulfis.",5,"72 Reviews , 1715 Followers",8/31/2018 22:46,6,
Barbeque Nation,Rajesh,"Good service, very good receiving nature.
Very well satisfied with his service and the food.
Outstanding service by azad hussain with good responsibility towards customers.",5,"1 Review , 1 Follower",8/30/2018 23:02,0,
Barbeque Nation,Varun Reddy,"Loved the food, ambience is good, deserts could be somewhat better but overall i would recommend this place. Staff is friendly. Chicken is the best of all the dishes they serve.",4,"125 Reviews , 4642 Followers",8/29/2018 1:02,0,
Barbeque Nation,Esli Jacinth,"This was my first time at a ""Barbeque Nation."" I've heard great things about it, people sounded like they serve food from heaven.
Now, let me tell you about my experience at this outlet, not going to judge the other outlets. The service was not good, we had to call em' more than thrice to get the starters served, the chicken tasted stale, fish and prawns were amazing though. They were serving complimentary drinks, I selected ice tea, worst one I've ever had.
The good thing about this place, their ""manager,"" he knew we weren't happy, tried his best to make things right for us, made the chef come to our table, which felt good and cared for.
I liked the ambience of this place, will definitely give another chance to this outlet ✌️",3,"20 Reviews , 7 Followers",8/24/2018 19:18,1,
Barbeque Nation,Indranil Saha,"I visited this branch for Independence Day lunch with two of my friends. As usual Barbecue Nation was superb at its food and service. People in Hyderabad prefer AB’s over BN, but somehow I felt BN is still a better place. Staff members were really good and everything was so delicious! We really enjoyed our time there. Thumbs up 👍",5,"36 Reviews , 196 Followers",8/15/2018 21:42,1,
Barbeque Nation,Shrikant,It's always good to visit this place. We celebrate some of our most precious days. Good quality and service is excellent. I wish you keep this quality always.,5,"8 Reviews , 3 Followers",8/12/2018 18:42,0,
Barbeque Nation,Karthik Kumar,Service was excellent and staffs were much polite. Frequent visits by chef to make sure taste is acceptable was laudable but after a point it had bit vexed us. Ambiance was good but space was very less hence during weekends it sounds like bring in a market.,4,"19 Reviews , 10 Followers",8/12/2018 15:15,1,
Barbeque Nation,Vivek Dasari,Food is excellent.......ambience is very good......loved the Greek festival......Azad Hussian gave us a very good service......overall experience is excellent.....,5,"1 Review , 19 Followers",8/9/2018 23:03,0,
Barbeque Nation,Abhiteja Ch,"Amazing food and ambience.
Starters were simply delicious.
Desserts were also really good.
Would definitely recommend everyone to visit this place.",5,"87 Reviews , 285 Followers",7/31/2018 23:43,0,
Barbeque Nation,Age Of Foodies (Suraj Karambe),"Unlimited BBQ food with delicious desserts-
Ambiance-
Barbeque Nation is located near Wipro Lake exactly beside Deli 9 Bistro. This outlet of Barbeque Nation is quite congested. As it is situated at the Ground floor, indoor sitting includes well maintained sitting arrangement with large tables of capacity upto 8-10 people per table. They play silent English songs in the background.
Food-
As we have arrived before 7pm, we got the privilege of the early bird complimentary mocktails. They served veg kebab and american corn before starting the barbeque. As we were six members they brought 2 barbeques. In the barbeque they served all types of non vegetarian and vegetarian food including prawns, chicken, fish mutton, paneer, potatoes, corns. We had lots of prawns and fish in the starter and had for at least 2 hours. After that, we moved towards the soup, they have only one non veg and one veg soup. We requested for hot and sour soup, so they prepared for us. In main course they served veg as well as non veg curries, Chinese and biryani. Finally they had a large variety of desserts in their menu including kulfis, ice creams, Gulab Jamun, pastries, firni and brownies.
Service-
Service was very quick and the staff was very good. Chef himself came to our table to take the feedback.",4,"104 Reviews , 334 Followers",7/31/2018 23:27,0,
Barbeque Nation,Prasanna Kalyan Vittapu,The service is too good.. If you are not satisfied with any food item basudev will recook as per your wish and serves it again... The service is just excellent compared to other outlets..,5,"1 Review , 2 Followers",7/30/2018 17:29,0,
Barbeque Nation,Atul Mani,Food was tasty. Staffs were very friendly. Although the options in main course as well as for starters was a bit less and service was relatively slow when compared to other barbeques. Still would recommend to visit once.,4,"45 Reviews , 122 Followers",7/27/2018 11:24,0,
Barbeque Nation,Chinmaya Barik,"Visited it along with my friends for lunch today..
Most of the staters were served was of same taste n less grilled.Fish n chicken n prawn everything tastes same.After repetative reminder also they served the same.Also there is not much varieties are available for stater.Main course is ok.Deserts are pathetic.They are serving it for namesake..It's a horrible experience overall",1,1 Review,7/21/2018 19:31,0,
Barbeque Nation,ZENITH Meher,"I visited today . To be honest it's waste of money .... Everything that they serve tastes the same ... There is no variety of tastes... Fish and chicken almost tastes similar... It's like they have put the same spices on Fish .. chicken , mushroom and prawns.. Deserts are simply the worst.... It's like just name sake they are serving ...
For those who want to taste something good.. it's not recommended.",1,1 Review,7/21/2018 19:19,0,
Barbeque Nation,Neha Aggarwal,"I went there with my parents, and it was totally worth it. The service was extremely good and my parents loved every bit of it.
Starters and dessert always amazing.
Main course have a lot of varities but we always fill ourselves with starters that no place is left in stomach to try main course.
Overall it has been one of my favourite place .",5,"91 Reviews , 191 Followers",7/20/2018 14:48,0,
Barbeque Nation,Smruti Ranjan Mishra,Qutub Yasin - It was really an awesome experience with these guys. He was really friendly and we had a very good conversation him. I will come back hungry for more.,5,"1 Review , 10 Followers",7/15/2018 23:34,0,
Barbeque Nation,Srinivas,"Barbeque Nation absolutly Great place to Dine with frinds r family..
Buffet was simply mouth watering food..
Ambince superb
Service great ..
Great exprince we had..
We want to visit again .......",4,"34 Reviews , 7628 Followers",7/14/2018 13:10,0,
Barbeque Nation,Salman.Ghaffoor,"Went for lunch along with wife and bro for birthday lunch, And Lunch was perfect and had some decent items on menu, Gopal took good care of us. I would recommend this place for great lunch.",4,"21 Reviews , 33 Followers",7/7/2018 18:59,9,
Barbeque Nation,Vedant Killa,"Excellent service and food buffet! This place has really warm service and they are always willing to customise the menu since it becomes repetitive otherwise. The pocket pinch is slightly higher, but it's totally worth it.

Then best starters are Cajun potato, crispy corn, mushrooms, dahi kebabs, corn tikki. All the starters are lip-smacking. Make sure to keep room for the main course.

I haven't tried many options from the main course, though, dal makhani and rice is a very comfortable choice.

Coming to desserts, gal Jamuns are literally out of the world. Try them with a scoop of vanilla ice-cream. You wouldn't want to eat them anywhere else! Alongside, pan kulfi is a must try. 😍😬 there are a plenty of other desserts to choose from.

Always up for a BarBQue grill 🍖",5,"86 Reviews , 216 Followers",7/6/2018 20:52,1,
Barbeque Nation,Sunil Tatipelly,"Visited it along with my friend for dinner buffet last week. 

Most of the starters were served slowly. Even after repetitive reminding no response from the staff. Fish starters were not well cooked. Chicken starters & crispy corn were good.

Mains and desserts were good as usual, not much different from others.",3,"9 Reviews , 19 Followers",7/5/2018 16:17,0,
Barbeque Nation,Tarannum Ara,"More expensive than the other barbecue counterparts but once you experience this place, you will realise why it's worth every penny. From the starters to the main course. Everything was rich in flavour and taste. Softest mutton sheekh kebab ever I tasted here. The menu didn't include mutton keema, yet our waiter Gopal served us some with pav and ghee naan. His hospitality is worth mentioning. The head chef came and took our feedback. Very warm ambience, good people and great food. Don't miss this place.",5,"6 Reviews , 45 Followers",7/3/2018 16:46,0,
Barbeque Nation,Ritobrata Choudhury,"Barbeque was good in taste. Quality of fish chicken mutton was perfect. Though main course variety was less, overall i liked the place. Diligent service by all staffs. The head chef also wanted feedback for the food, which i personally like very much! Happy to visit another time!",4,"7 Reviews , 29 Followers",7/2/2018 15:43,1,
Barbeque Nation,RAVI RATHORE,"Good food. I visited 4 times and i like the food.. good hospitality.... ambiance is ok..
Deserts was mouthwatering...I will definitely visit again.. thanks for making my day special.. 🙂🙂🙂
all the best👍👍👍👍",4,"10 Reviews , 296 Followers",7/1/2018 16:23,0,
Barbeque Nation,Saumya Ranjan,"It’s a hell of party when you land with your colleagues or friends at barbecue nation. I should not say about the tenderness of grilled fish, chicken and mutton kebabs being served as starters but also about the veg dishes that grabbed my attention. The main course meals were really nice and dessert was also pretty good for the meal package. It’s a must option if you are choosing for corporate meals, birthday celebrations or friends hangout.",4,"34 Reviews , 50 Followers",6/30/2018 14:37,0,
Barbeque Nation,Yoga,We went here from office. A group of 17 members. We were the first so seating was not an issue. I had veg starters and it was marvellous. For once the spice levels matched my lower than normal Hyderabad spice margins. The paneers were too soft for the skewers and kept dropping into the fire. The corn fried were very good. Food was excellent especially the sweet corn soup. Desserts we very good. On the whole a satisfying experience.,4,"62 Reviews , 1193 Followers",6/26/2018 19:51,0,
Barbeque Nation,Chanda,"Always good , for non veg starters are too good than veg , still overall it's good , always biryani will be same kasmiri flavoured , hope next time I may get new flavoured biryani , rest all staff and service were good",4,"106 Reviews , 763 Followers",6/23/2018 21:32,6,
Barbeque Nation,Sind Hu,Barbeques are one of my favorites. Barbeque Nation is a perfect blend of good food and Ambience. Always been best at servicing. Would be better if they try something new for birthday wishes.,4,"61 Reviews , 167 Followers",6/23/2018 20:18,1,
Barbeque Nation,Deepak,"Quick review points
- slippery floor .. be careful when you good with high heels or children. Perhaps they don't have time to clean it up to reach standards of safe place
- bathrooms meant for rotten rats... Dirty washroom and tiny doors. Hefties and jumbo sizes, you can't get in
- service ... Ohhh they can't handle crowd from 8 pm till the place starts getting filled up. For sure you will get feel of crowded market where waiters shout and chatter, but service time and order time is pathetic.
- advance bookings ... They don't understand what means advance booking as soon as u step in
- pan kulfi... It should rather be named as sugar syrup topped with milk and green color. Pathetic and not worth giving tough time to your taste buds.",2.5,"2 Reviews , 3 Followers",6/23/2018 14:54,0,
Barbeque Nation,Sai Prasad Koneru,Food is good. The service from the staff is excellent. Worth every rupee. Reasonable price when compared to other barbeque.. service from the staff is excellent...,5,"9 Reviews , 35 Followers",6/22/2018 14:48,2,
Barbeque Nation,Siddhartha,"Serving is nice,food is good starters are good enough to get a 3 star main course is excellent when compared to absolute barbecues but star of the show is malai kulfi.absolute show.stopper of the buffet.",4,"2 Reviews , 3 Followers",6/11/2018 15:03,0,
Barbeque Nation,Deepthi,"Barbeque’s are famous for their huge spread in the starters range, so was this place. Have almost visited most of the barbeques in the city. Similar menu and nothing outstanding in this restaurant. Taste was average.
Staff were very polite and the service was good. Loved the pan kulfi.",3,"19 Reviews , 9 Followers",6/4/2018 18:24,0,
Barbeque Nation,Raj Kamal,Good place for birthdays and similar events. Wide variety of food items available. Had visited the place during some fest wherein I found lots of varieties.,4,"8 Reviews , 13 Followers",5/27/2018 15:08,0,
Barbeque Nation,Chandrakanth P,"Visited this place on our marriage anniversary. Food was excellent. especially the starters. liked the mutton sheek kebab more. meat was tender and tasty. bbq prawns were good as well. veggies will love crispy corn here. Can improve on the desserts variety.
Service was excellent. Right from the valet guy to the manager, every one were courteous.
Azad who served food for us was very assistive and always checked if we needed anything. Chef was kind enough to ask us about the food and cooked chicken specially for us which was terrific. All seemed perfect for a perfect day.",4,"2 Reviews , 23 Followers",5/26/2018 18:22,0,
Barbeque Nation,Kanukunta Saimounika,"One of the best place I've ever went to buffet. Especially the great service provided by the agents over there , it really impressed. It was on my birthdae :) April 2. Sorry for the late review.
Starting from Welcome Drink till the complimentary cake , the food was so delicious.... Great Job !!!!",5,"3 Reviews , 1 Follower",5/26/2018 5:05,0,
Barbeque Nation,Swarooparani Gali,"Have been there for our wedding anniversary. Excellent service provided be staff. Non veg starters were too good. Ambiance was also good. Didn't feel the main course that great compared to starters (Didnt like Chicken Dum biryani). Enjoyed desserts a lot especially Kulfi

Thank Staff for helping us and celebrating our event :)",4,"1 Review , 1 Follower",5/24/2018 17:06,0,
Barbeque Nation,Teju,"You guys are really awesome. What else a foodie like me can expect for lunch, good food and great hospitality......I should take a minute from my routine to appreciate the service and hospitality provided by Mr. Vibhishan and Mr. Susheel.......
Though you are the best the curiousness to improve by incorporating inputs/feedback from customers by you are great.....",5,"12 Reviews , 5 Followers",5/21/2018 15:22,0,
Barbeque Nation,Vinay,"A place to go with friends and family. Hospitality is just at the next level. Staffs are very polite and know how to delight the customers. Well, starters and deserts are simply awesome. I don't munch much on the main course (not enough space left after yummy starters).
I liked the way staff took my concern regarding pastry where I felt contained an egg (I am vegetarian). They not only ensured me that the said pastry is egg less but also offered me special chocolate chips icecream. You guys are just too good in the hospitality. Will love keep coming back there.",5,"6 Reviews , 5 Followers",5/20/2018 18:34,0,
Barbeque Nation,Priyanka Paul,"Numerous options. Grilled chicken and prawn , all the kulfis in different flavors are tasty. Pineapple jalebi was very different but okz in taste.A perfect place to satisfy ur hunger with great food , ambiance and service.

Great staff. The service is very good. You can ask them to serve the starters according to ur taste requirement (spicy or mild). Please do the advance booking as it have rush on all the days.",5,"62 Reviews , 57 Followers",5/15/2018 16:07,0,
Barbeque Nation,Advait Shiralkar,"I have visited barbeque nation multiple times and it has been beyond my expectations every time. I love the items which they keep on their grills especially the non-vegetarian ones. in the non-veg ones I most like their prawns and the fish. I had forgot to mention the service and the ambience. the service is good and even the ambience is great. in of the grill I like the crispy corn and  the and some aloo thing they serve it is always awesome. as we went there on jewel of the sea festival, I had got crab curry (with no flesh in it) and we had butter naan and tandoori roti. crab curry was not so great but nice. the butter naan was great and even the tandoori roti was nice. we even went for curd rice and dal makhni. both of them were nice. my overall experience with barbeque nation was awesome.",4,"22 Reviews , 52 Followers",5/14/2018 9:19,0,
