Restaurant,Reviewer,Review,Rating,Metadata,Time,Pictures,7514
Barbeque Nation,Deepak Belel,"#Foodengineeringg
#RamadanSpecial
#Reviewmode

Bbbq nation has come up with all new DAWAT -E - RAMADAN Where they've bought in few of the best Street foods of Ramadan which really makes one visit and satisfying their foodie soul's!

I was pretty excited to try out their Ramadan special menu and the moment I enter I see a Big Raan marinated well on the pan and sizzling hot Mutton Chops searing on ghee! That view Enticed me and I just walked toward it to see that beauty happening. I couldn't wait to try that Super appetising Chops and delicious Raan!

Besides they also got chicken Shawarma and MUTTON HALEEM Which is another different delicacy storyline...
I had to take a big bowl of Haleem with some birista and dash of lemon squeez and Final touch with Two spoons of Ghee. Yes that's my style! 😉

I walked to see few more exciting dishes and I found the legendary Badami Gosht! Yes just the glance of it made my mouth water and besides Murgh Mussalam was also calling me with its own aroma, that spread of cream on it made it look like show stopper and make anyone try and lick their fingers...

Cannot miss Thier Gosht Biryani 😋 one fine plate of heaven where every spice and meat married so well. Perfectly tender meat and soft and Fragrant basmati with a touch of Ghee!

Only because of the taste and being foodie I had two rounds of everything and was full...
But there's always a another stomach for kulfi!
Pan-Pista-malai, Voila!",5,"192 Reviews , 2124 Followers",5/23/2019 15:31,10,
Barbeque Nation,Ananthulaprudhvidhar,"This is one of my favourite restaurant with grill concept. Ambience was really fascinating ,food quality was too good , my favourite recipe is grill pineapple it is delicious.",4,"10 Reviews , 5 Followers",5/19/2019 13:12,0,
Barbeque Nation,Vinay Srivastava,"Have been a huge fan of this chain since 2013. Have been to the restaurant in different cities, and have noticed some significant differences across all locations.
This Gachibowli BBQ Nation has some items missing from its live counter, but have curd rice which wasn’t available in any other location I have been to.
The staff is extremely courteous. We were served by Rajib, who was really warm, quick in his service.
The overall quality of the food was satisfying, just like most of the other outlets I’ve been to.",4,"68 Reviews , 185 Followers",5/5/2019 17:13,4,
Barbeque Nation,Gourmet Hunter,"As usual it's fab place to have grill in a buffet. Non veg is awesome here. Chicken, Mutton, Prawns, Fish are served on the grill. Some days you also get crab curry. Now they opened tawa starters as well.

Nice place to go for team lunch/dinner.",5,"231 Reviews , 407 Followers",5/4/2019 13:58,7,
Barbeque Nation,The Food O’Clock,"Food quality is good. But not so many items, like crabs, octopus, kofta are available , particularly in this branch which are available at other branches of BN or ABs. So, it was really disappointing.

Also service was a bit slow, we really had to wait for items to come on our table in between. That really turns off our mood though the waiters are jolly n try to make us feel good. I think the number of waiters are less.

AC facility was good, very cold.

But I don’t recommend this place.",2,"25 Reviews , 13 Followers",5/3/2019 15:36,0,
Barbeque Nation,Sahithi Anchuri,"This is an amazing place for Veg as well as Non Veg starters. There are so many varieties in it. As you will be already full, you don't generally go for Main course and also it's very average. I really love their service. Suppose you don't like item, they will replace it by customising according to your requirement.",5,"18 Reviews , 18 Followers",4/27/2019 22:12,1,
Barbeque Nation,Dashrat,Service was excellent biriyani and service excellent very nice food very good staff and servise drinks was excellentb.bq chiken very test and fish pine apple very test service and food quality is excellent,5,"2 Reviews , 4 Followers",4/27/2019 1:21,0,
Barbeque Nation,Sandeep Srivastava,Was wife's birthday and our anniversary as well.. Naresh and Bipul made it point to make it extra special. The hospitality and the culture of the employees keeps taking me back there forever..,5,"20 Reviews , 123 Followers",4/21/2019 5:57,0,
Barbeque Nation,Pritha Chatterjee,"This place always exceeds expectations!!! Friendly staff, customised orders and finger licking good food!!! And of course you need a second stomach for the desserts!!!",5,"3 Reviews , 47 Followers",4/14/2019 12:47,0,
Barbeque Nation,Raja Gopal Reddy Chereddy,"It's Barbi boss...no comments.
It's was sudden plan from Gang to visit this place, fortunately that day was 10 years celebrations day of BN.
We got some discount on bill also. We all from coastal area basically and sea food lovers.
Believe me or not, I loved and felt happy wit prawns here...yummy and yummy.
It might silly...we did justice to my money, may more also.
That was a weekday and I want to try this place on some weekend",5,"20 Reviews , 27 Followers",4/9/2019 22:54,0,
Barbeque Nation,M.shravan Chowdary,"Had to wait a bit to get a table that's a good thing 😄, great food and best service such a great staff Sudeep Roy, Naresh ur a star I have seen him doing everything keep up the good work guys",5,"2 Reviews , 104 Followers",4/7/2019 16:30,0,
Barbeque Nation,Anirudh Bhattacharjee,"I am a big fan of BBQ nation since a decade now. This however was my most dissatisfying experience to date, after visiting several of their locations across the country including this one in the past.

The only thing they handled well, from the word go was the seating. I booked a table for 14 from zomato. It was ready for us when we arrived.

Everything else seemed to be falling apart, their team was struggling to deliver.

The starters took forever to be served. Most of them tasted similar though were called different things, refills were small portions and we had to keep requesting for more which is unlike how bbq manages things. The mocktails seemed watered down and on highlighting this, some were duly replaced.

The chef did come to check on us and on sharing our experience justified that our palate was confused due to tasting several dishes. When we held our ground, he went back to personally create some dishes. His version of the starters were way better but we were done eating by then.

I would like to highlight that the servers and chef were trying every bit to run around to meet requirements but seemed overwhelmed and struggled to get great food to the table.

Hope this was just a bad day and this outlet will get its act together.",3,"24 Reviews , 41 Followers",3/29/2019 17:36,0,
Barbeque Nation,Riyaz Ahmed,"Had a worst experience today at BarbQ Nation , gachhibowli, hyderabad

Taste is not as good as remaining branches. Non veg items seem to be frozen few days back then coocked, feels like a was while eating",1,"2 Reviews , 1 Follower",3/23/2019 17:00,0,
Barbeque Nation,Vikas Jain,"This is the worst barbeque , i have ever seen in my life. Barbeque for name sake. No barbeque item like paneer, fish was baked properly. waste of money",1,"1 Review , 1 Follower",3/20/2019 14:04,0,
Barbeque Nation,Phaneendra,"We went to this place as a part of corporate outing. It was my first time to Barbeque Nation. I must admit that I was pretty much humbled by the chef coming over very often and asking if the food was up to our satisfaction. The starters alone were enough to fill up my belly. When it came to having the main course, the options were not many but it suffficed, I would say. The waiters were patient enough to serve us whatever we needed and we all left with a happy note and fat bellies.",4,"4 Reviews , 1 Follower",3/3/2019 17:54,0,
Barbeque Nation,Chhaya Sharma,"Barbeque is mostly my favorite but if I compare barbeque nation with Abs , sahib's barbeque... obviously I have to give one point less to this one...food is good but limited items..but if you have kid go there my son and my friend's kids enjoyed a lot there they were given car and balloon by staff and lots of fruits and french fries...they enjoyed to the core... ambience is gud service excellent...

Food 3/5
Ambience 4/5
Service 5/5",4,"10 Reviews , 23 Followers",2/23/2019 22:46,2,
Barbeque Nation,Aarunvalissha,"This Place was really amazing, as usual the staff is very polite, Appreciate their work in maintaining professionalism, loved being serviced by Saif Ali Khan and staff..",5,1 Review,2/23/2019 8:55,0,
Barbeque Nation,Mario Fonseca,Been to the place recently. The service was on a slower side strangely but the food items on the grills taking a little longer to arrived. Food good as usual,4,"45 Reviews , 82 Followers",2/21/2019 21:27,0,
Barbeque Nation,Abhishek Gupta,"Friday afternoon, We planned team lunch (veg & non-veg) in Gachibowli Barbecue Nation. We were asked several times to give excellent rating by various attendants which was quiet annoying while we were having lunch even though food & variety served was average and wasn't upto standard w.r.t taste & variety.

In short, it wasn't value for money. 

I think it would be better to choose Absolute Barbecue over Barbecue Nation, as customer you get value for money. Seems like now Barbecue Nation is just riding on its legacy.",3,"1 Review , 38 Followers",2/8/2019 16:53,0,
Barbeque Nation,Siddik Khan,Inside Atmosphere is good....and serving and way of treating everything I loved it.....and very reasonable price for parties..we can enjoy with friends....,5,"2 Reviews , 26 Followers",2/7/2019 2:08,0,
Barbeque Nation,Vasu Taneja,"A well-known place to have buffet

Staff(5/5)

Starters(4/5)

Dessert(5/5)
Try chocolate kulfi and paan kulfi.

Mojito(3/5)

Main course(3.5/5)

Overall experience(4/5)",4,"86 Reviews , 2479 Followers",2/4/2019 17:37,0,
Barbeque Nation,Vamsi P,"Located in the heart of Financial district it is very convenient place to visit on a weekday with colleagues. Their service was simply superb, they tried to understand the requirement of the customer’s on each and every table and customized the spice level etc., based on the request. Had good number of options in Veg as well. Over all food was very good, service was exceptional.",4,"52 Reviews , 43 Followers",2/2/2019 18:12,0,
Barbeque Nation,Kaveri Saicharan,Kirak Bole tho kirak Hyderabadi language just loved it had a nice time enjoyed the food mainly pan Kulfi loved iiiittttttttttttttttttttttttttt,5,1 Review,1/31/2019 23:00,0,
Barbeque Nation,Ankita Kumari,"The staffs at BBQ Gachibowli are very good. From start to End they took care ,which dish is good,any modifications needed.
Food was very tasty(starter+Main course)
You can try Fish Finger(chefs special) made on Request.",5,2 Reviews,1/31/2019 5:49,0,
Barbeque Nation,Avinash Cena,"friendly service
The restaurant ambience is good
The food tastes good
And they need to increase the desserts
And jst increase the items
Awesome finally",5,"2 Reviews , 1 Follower",1/28/2019 13:33,0,
Barbeque Nation,Yankeedba,"Been many times here and the place is not crouded during dinner time, the best time to visit this place is during dinner time only as lunch time too much crouded with office guys specially Mon to Fri, coming to food , prawns and fish starters are too too good , other kebabs also too good, staff is too good in service and they treat us like kings and queens, I strongly recommend Gachibowli branch as less crowded during dinner and weekens",5,"6 Reviews , 5 Followers",1/27/2019 21:41,0,
Barbeque Nation,Phaneendra Ch,"The taste of increase when its BBQ,its taste doubled when is comes to Barbeque Nation ..Service is more jet sped..food was excellent..need little improvement in ambiance",5,"12 Reviews , 40 Followers",1/24/2019 21:10,0,
Barbeque Nation,Food Junkie,"Waiters butter customers more than the kebabs 😂, jokes apart the service is too good and they do have a decent range of items, eventhough they lack in terms of number of items but it's compensated with the quality level. The place feels a bit cramped up bt got a good vibe to it. Definitely would visit again.",4,"29 Reviews , 16 Followers",1/24/2019 13:56,0,
Barbeque Nation,Imran Asghar,"Awesome place, Awesome food, lovely staff (Azaad Hussain) was tremendous at his work one of the most polite guy I ever see in any restaurant",5,1 Review,1/21/2019 21:19,1,
Barbeque Nation,Syril Thomas,This place is good when you come empty stomach... Just kidding . Barbeque Nation have been always my favorite when it comes to barbeque and their amazing mocktails and juices as they keep innovating the menu and the deserts. Has a lag in my order when I had been there last time but I guess it may be because of the high intensity of people who come and dine. A very good place with very welcoming staff.,4,"59 Reviews , 197 Followers",1/13/2019 10:54,0,
Barbeque Nation,Gautam,Went yesterday to bbq. Wonderful service. Special thanks to Roy who took care of us.he kept checking if everything was fine or need to customize anything. Food was yummy. Became a big fan of bbq. Good going guys!!!!,5,1 Review,1/11/2019 9:16,0,
Barbeque Nation,Purnima Powell,"Early Christmas celebrations. we were dressed up and wanted fine dine. We were told that Barbeque Nation is always booked, we tried our luck anyway and got a table for 9:30.
From the greeting to serving and the host was so nice...I must give them 5 stars for excellent customer service.
The Starters were amazing....I love prawns but it's kinda tricky to get perfect and well seasoned 
But their Prawns are the best grilled prawns I ever tasted. They could have done a little better job for tandoori chicken but it was fine ..... the starters were so yumm that we didn't want to try the main course.... My personal favs were Grilled Prawns and RoseMary Chicken...mmm..  mmm... mmmmm yummy !!!! 

Thank you so much for your excellent service and Great Food..Hope to visit you guys soon..!!!",4,"87 Reviews , 137 Followers",12/26/2018 8:32,0,
Barbeque Nation,Sreejith Sreekumaran,Who doesn't like BBQ and having it from BBQ Nations is a good experience. Chicken tikka nadi fish are really tasty. As part of new year celebration there were some new dishes which was passable. Expected better in desserts,3,"207 Reviews , 299 Followers",12/24/2018 22:22,8,
Barbeque Nation,Beeshwamohan,"We have been having a grand time whenever we visit Barbeque Nation Gachiwoli.. Be it the food, the ambience and the hospitality of the staffs, this place is a must visit.. the staffs here treat you as a part of family and serve you till you get the utmost satisfaction on the taste and quantity of the food.
I would specially like to mention about Mr Naresh from BBQ nation Gachiwoli. The way he treats and welcomes you will make you visit this place all over again and again.. He takes care of you from giving you the best seats available to the best of the food you can have. I give him and this place 5 bright stars..",5,"3 Reviews , 6 Followers",12/18/2018 18:39,0,
Barbeque Nation,Sthiti Chakraborty,"Food: 4.5
Ambiance : good enough
Service : the staff were all very polite but a bit slow

The taste of food was very good. They had chicken tandoori, mutton kebab, veg kebab, American corn, creamy crispy potato as starters apart from the grilled stuff. On the grill they served one variety each of chicken, basa fish, prawn, mushroom, paneer, pineapple. The main course did not have much variety but honestly no one had enough space for it. The dessert options were sorted and tasty. They had 2 ice cream flavours, Gulab jamun, kheer, brownie, milk cakes, pastries and tarts, 2 kulfi. Over all the experience was very good.

Would want to visit again😊",4,"118 Reviews , 771 Followers",12/17/2018 22:23,2,
Barbeque Nation,Pavani Rajyam,It used to be one of my favourite places and the destination for all family celebrations. However over the time I feel it has lost that touch. There is no more aawww feeling when u eat at this place. They don’t compromise on the quality of food but I was disappointed with the taste. We tried at both forum mall and gachibowli branches and it felt the same.,3,"30 Reviews , 66 Followers",12/16/2018 21:48,0,
Barbeque Nation,Kiran,Been here with friends on a weekday for dinner and this place never fails to meet expectations...be it any outlet. The food is great...the staff was friendly. Only one negative with this outlet is space...it is extremely congested...the tables are too closely placed...hardly any proper aisle space for guests to walk!,4,"27 Reviews , 15 Followers",12/16/2018 14:57,0,
Barbeque Nation,Ajay Singh,"Great staff always ready to serve with smile, celebrated our anniversary over there got exceptional service by Ravi, Kumud and Chef. Always take care of our spice level... Love to visit again and again........",5,"1 Review , 39 Followers",12/15/2018 22:38,0,
Barbeque Nation,Nishanth Kumar N,"Very much satisfied with the food and service. They had customised kulfi with different types of toppings and it's really good. The non-veg starters are served with normal spice levels and are tasty. If you like spicy food, ask for Tandoori chicken with extra spices. You will love it.",5,"2 Reviews , 8 Followers",12/13/2018 17:19,0,
Barbeque Nation,ATUL KUMAR SINHA,Had been there twice. Everytime had a wonderfyl experience. Good ambience and very friendly staffs. The chef himself turn to us asking for any special items to be ordered. Great service.,5,6 Reviews,12/12/2018 23:33,0,
Barbeque Nation,Hanisha N,"Food:
I had the Non Veg buffet.I loved the starters and the desserts.I personally like their Kulfies the most.

Everything else:
I have been to this branch twice. Service is really good.I had a great experience. Its the best barbeque restaurant I have been to.

Will I go again? Definitely!",5,"7 Reviews , 5 Followers",12/6/2018 15:47,2,
Barbeque Nation,Sidhant Girglani,"We were here to give our treat to a group of friends. What started out with cold barbeque, bad grills turned out to worst. The grill was replaced and hot starters were served so the point of the grill was totally made redundant. As soon as we pointed out that the service was slow and the starters weren't coming quickly, we dint know what we were calling for. The waiters visited our table every 2-3 mins to enquire if everything is alright now. I am not exaggerating when I say that they came to me at least 20-25 times in the next one hour to let them know that they are doing good. I did not dare to say that they weren't still good with the service and starters we were asking were not coming. They almost forced us to say they were excellent as apparently the rating for them was important even if it meant disturbing us every odd minute and spoiling the whole meal. Finally I was forced to give them an excellent rating as the man stood next to me till I did that. Feedback is to improve and not to be used as a tool torture. The food was nevertheless mediocre except the mutton sheek kabab and chicken pepper soup which was good. Barbeque nation, please don't pay your folks based on our ratings if you are doing that coz it's extremely irritating being answerable every minute. Btw, this was my second experience of feedback taken wrong but the first one was not as bad.",1,"22 Reviews , 17 Followers",11/29/2018 1:50,0,
Barbeque Nation,Siddhartha,"The best restaurant we have been to, till date.
Awesome food and great service. The hospitality shown at the restaurant each and every time that we have visited is at the peaks compared to other restaurants. we treat this restaurant as a family restaurant and make sure we visit this once a month. Never disappointed us in any aspect..
not even once..",5,"10 Reviews , 9 Followers",11/27/2018 20:51,0,
Barbeque Nation,Keerthi M,We went to barbeque nations for thanks giving special day team lunch.Items are good. But service is very slow. We waited for long time for food items after ordered.Deserts and starters are nice.,3,"48 Reviews , 15 Followers",11/24/2018 10:21,1,
Barbeque Nation,Sree `,Good place for team lunch but has pathetic veg starters option(potato and mashroom) but they tell will smile that this is all for today .I am writing this review whole I am in the restraint itself.improve Barbeque..every customer is important.,1,1 Review,11/23/2018 13:25,0,
Barbeque Nation,Asad Ullah Khan,"For ravi , he is friendly. Politely answering to questions. Good in taste yeah it's very good everything is fine and the kulfi you don't believe me",5,"1 Review , 11 Followers",11/22/2018 16:08,0,
Barbeque Nation,Moumita Panda,Extremely courteous staff & great service...Special mention to Kumud Barman for his exemplary service...keep up the good work guys 👍..Good job,5,"6 Reviews , 73 Followers",11/18/2018 23:16,0,
Barbeque Nation,Amar Nath Tiwari,Nice place very good food but main course should be be improved because starters 4 dessert 4 and main course 3.5 because food in main course was not upto mark need some taste build up,4,"41 Reviews , 110 Followers",11/8/2018 21:55,0,
Barbeque Nation,Vivek Kumar Dubey,"5 star standard . Specially mentioning RM Mr. Bivison and staff Mr. Gopal.. we were welcomed, served and treated with high standard quality. Also, the chef Basudev make sure that our prefrance is fulfilled.
Thank you Bivison and for taking care.",5,"4 Reviews , 19 Followers",11/4/2018 22:26,0,
Barbeque Nation,Harry N,"Excellent place.
Taste of food is good. Spread is good. Value for money.
Service is excellent.
If you wish to go for a barbeque, this is the best place in hyd.",4,"28 Reviews , 9 Followers",11/2/2018 12:18,0,
Barbeque Nation,Asad Rana,"Have visited this place on 2nd October with my family to celebrate my sister's birthday. All the places were booked but luckily got seats in late hour for lunch. Place is not that huge but very well maintained, hospitality is top notch by their staff.

Coming to food, starters were served as well as barbeque was set up on our table. Chicken, prawns, mushroom, paneer and seekh kebab all were marinated very nicely. It was really amazing in taste. Potato prepared with mustard sauce was just wow. There was no dish which didnt disappoint.

Main course - This is the part where they have exceeded and crossed all the expectations. All the dishes were really good in taste, usually I skip main course and go for dessert after starters bit here I have tried and it was really good. Egg curry, chicken, mutton Rogan all were good. Biryani was also good. Noodles with sauce were delicious enough. It wasn't their just to keep up the numbers.

Dessert - My favorite part and completely satisfied my sweettooth. Pastries, please cake, kheer, brownie all were good. Kulfi was nice which was served with little bit of rabdi on the top.

Overall we had a ball at this place, from starter to main course and dessert all were really good. They didn't give us any point where anything can be deducted. Service was top notch as usual and value for money. This outlet is one the best on in Hyderabad hands down.",5,"362 Reviews , 4102 Followers",10/31/2018 1:37,6,
Barbeque Nation,The Foodie Bookworm,"We are very satisfied with the food and the service was excellent. ""We want our customers to be fully Satisfied"" said the chef and he meant it.",4.5,"108 Reviews , 242 Followers",10/25/2018 7:57,0,
Barbeque Nation,Prasad Kayal,"We went to this place on Wednesday for Dinner. It was difficult to find a table and had to wait for 30 minutes. The ambience of the place is average and its a small place however the starters were really good (Crispy Corn, Panner Tikka, Mushroom and Fruit BBQ). Coming to the main course, it was average but the desserts were really good especially Gulab Jamun, Rabadi and Kulfi.",4,"34 Reviews , 53 Followers",10/21/2018 15:32,0,
Barbeque Nation,Sudeshna Banerjee,"Really These BarbeQue Nation's outlet is so friendly....i never seen before....we went there last night, total number were 40+...lots of kids were in my gang....they are playing a lot....they are means staffs of Barbeque Nation, always looking smile....now, foods are just too good...Kuch kehene ki baat i nehi hain",5,"2 Reviews , 32 Followers",10/21/2018 12:09,2,
Barbeque Nation,Epicure,"To start with , the complimentary drinks Blue mojito , pacific blue , fresh lime soda were refreshing. The nonveg starters were all with subtle flavours and requires some attention for increasing taste be it lemon chicken , prawns or fish. Head chef made chinese schezwan chicken starter which has made our day. The veg starters - Mushroom is a immediate No , cripsy corn was not salted properly , paneer came as a saviour. Maincourse was not that luring or exciting but to mention malai kofta was a star performer. Coming to Desserts : Its either too dry or too sweet or too chilled. Browine was too dry , cakes were not tasty, apple/pineapple jelabi was overdosed with sugary syrup , phirni an absolute no , kulfi was too chilled that u will feel as if u r eating ice but if u allow it to drop to room temperatures then u can feel the flavour of it. Overall watermelon n papaya came as a saviour in dessert section. I can only rate it 3 for food , 5 for service , 3 for ambience as its too crowded going neck to neck in every counter.",3,"61 Reviews , 26 Followers",10/14/2018 12:09,0,
Barbeque Nation,Roopa2,"We had a fantastic time and loved the service and food both. The serving personnel made extra sure of comfort for the kids, kudos to Azaad and team.",5,2 Reviews,10/10/2018 5:53,0,
