Restaurant,Reviewer,Review,Rating,Metadata,Time,Pictures,7514
Cafe Eclat,Jay Mehta,"This place is a hiddengem!

Went to buy their sourdough bread.ended up having their mushroom soup, death by chocolate cake and key lime tart.

Mushroom soup came with grilled sourdough, everything was good about it. The bread could be toasted with garlic butter

The bread itself we ended up using as garlic bread with our pasta at home which was really good. The bread is something we will go again to buy.

Lime tart Was better than expectation . The cream was way too much.

Death by chocolate was delicious, rich chocolate. Was not able to finish in one go, will have to get on it tomorrow again.

Highly recommend this place. Will go their again for there sandwiches/sourdough pizza and burger.",4,"46 Reviews , 43 Followers",5/19/2019 20:40,3,
Cafe Eclat,Minocher Hansotia,Great selection of freshly made breads. Macaroons were well made. Breakfast here is a welcome change and worth the experience. Found all the items that I had were really good and fresh.Staff are very helpful and courteous. They know what goes into making quality bakery stuff and stick to it.,5,"6 Reviews , 44 Followers",5/18/2019 6:11,0,
Cafe Eclat,Asha Tejaswini,"Visit this place for awesome bakery options. Tried pasta and toffee apple doughnut. Though pasta is not up to the mark, apple doughnut balanced it out. The ambiance is pretty cool.",4,"14 Reviews , 10 Followers",5/17/2019 20:30,1,
Cafe Eclat,Rajiv Singh,Amazing breakfast options. Also happy to find some authentic Italian cuisine available here. Nice desserts as well. The coffee here is amazing.,4,"7 Reviews , 2 Followers",5/15/2019 19:08,4,
Cafe Eclat,Shwetan Sriram,"Terrific experience! Amazing place for breakfast/brunch! Loved the sour dough bread, hazelnut latte, french toast, pan cakes etc. One tiny suggestion is for you guys to serve more chocolate and blueberry sauce with the pancakes! loved the time spent here.",5,"32 Reviews , 197 Followers",5/10/2019 12:00,0,
Cafe Eclat,Amardeep Dabass,One of those little cafes that is as laid back as you want to be. The cold coffees and ice teas are pretty good. The ambience is pretty good too. Wish they had some board games or toys to keep little guests busy,5,"26 Reviews , 193 Followers",5/6/2019 0:00,1,
Cafe Eclat,Naina Bhardwaj,I didn't like the food at all !! We ordered thin crust pizza quatro formagio and it was not thin crust at all with very bland taste on top of that . Then we had the tuna salad which was too bitter to eat . Couldn't even finish it ! Then we went for a very cheese pannini . Another dish we couldn't finish . The bread was too thick to eat ! overall huge disappointment for me !,2,"32 Reviews , 10 Followers",5/4/2019 21:51,1,
Cafe Eclat,Anish Waghray,"Food is amazing , had their English Lamb Panini , Butter Croissant and Elderflower Lemonade.
Ambience could be better ..
Service/staff is/are courteous..
Slightly expensive ..But definitely worth a visit for breakfast.
Their Sour Dough Breads are good too",4,"4 Reviews , 6 Followers",5/3/2019 13:36,1,
Cafe Eclat,Shilpa Prusty,"Happened to try the breakfast option here.It is a good place to have english breakfast.All the ingredients are cooked ,baked fresh..The breads are really soft.We ordered swiss Muesli..it was delicious.However,the portion served was too less for 300 bucks..It was not sufficient for even a single person.We ordered baked spinach omelette,which was fluffy and melted in mouth.I have to say ,the taste was something I would wanna return here again for..French toast served with maple syrup was also nicely made..
Taste is spot on and so is the ambience with comfy sofas.
A bit expensive due to their natural flavours and self made products.",4,"70 Reviews , 169 Followers",4/28/2019 17:27,0,
Cafe Eclat,Apoorva Reddy,"Ordered tiramisu cup cake, brownie, green apple mojito and garlic bread. Unfortunately, nothing was good. Grossly misled by high zomato rating. Wouldn't recommend this place even to my frenemies!!",1,"3 Reviews , 30 Followers",4/28/2019 16:36,0,
Cafe Eclat,Utkarsh Ranjan,"Eclat has the best cheesecake in town. The blueberry topping on my cake was really fresh and delicious.
Their home baked breads are also a must try.",5,"14 Reviews , 62 Followers",4/26/2019 15:41,0,
Cafe Eclat,Mula Renuka,"This is one of my regular hangout place. It’s a small and cosy place. The ambience is decent and it has a see through kitchen. The food served here is very hygienic. You get to choose from a variety of options. The vegetarian options are limited though. I have tried their Pasta , pizza , hummus , coffee , hot chocolate , cup cakes , gelatos and soup. The taste of every item is good. The food looks very appetizing and tastes delicious. If you are searching for some cafe in Gachibowli then do visit this place.",4,"6 Reviews , 6 Followers",4/20/2019 20:56,2,
Cafe Eclat,Jeevak Gupta,My all time favorite for bakery items and pizza. Beats European Croissant any day. Try the butter croissant for breakfast. Don't miss the hot chocolate.,5,"11 Reviews , 49 Followers",4/20/2019 16:47,0,
Cafe Eclat,Megha Chanda,"Bakery items in the bread section are tasty. Croissants, bagels etc. Muffins are dense in texture and the icing is overly sweet. Definitely can improve on those. Not recommended for strong coffee seekers. If you want coffee coloured sweet milk beverages, then you can give it a try.",3,"6 Reviews , 53 Followers",4/15/2019 12:03,0,
Cafe Eclat,Shivani Gupta,"Food is really bad. I ordered aglio olio pasta, pesto veg sandwich, quesadilla, peach iced tea and broccoli sweet corn turnover starter. The taste was really bad, not even average. They put tomatoes in everything and the bread was really hard. I will never ever recommend this place to anyone.",1,"15 Reviews , 16 Followers",4/14/2019 16:09,0,
Cafe Eclat,Moonis Ahmed,"What a great find. Went for a late night snacking/coffee and the food, service, ambiance were amazing.

We ordered Basque Chicken Sandwich and Very Cheesy Panini accompanies with an Iced Latte. 

The chicken sandwich was delicious with crispy sourdough bread and juicy chicken inside. The bread tasted fresh and the sourness was accentuating the flavors. Served with crispy potato wedges and a coleslaw, the whole meal is quite filling.

The very cheesy panini was prepared with wholewheat bread and had a distinct cheese flavor to it. It could have worked with a little more spice but that doesnt meant the flavors were any less. 

Both the sandwiches were gulped down with the iced latte served in a tall glass.

Service was quick and the ambiance was pleasant with good music on play. 

Althought a bit on the pricier side, the menu offers a lot of variety and the place is recommended for their signature sandwiches prepared with their home baked bread.

Ambiance - 5/5
Service - 5/5
Food - 4/5
Value for Money - 4/5",4,"160 Reviews , 754 Followers",4/12/2019 23:45,4,
Cafe Eclat,Vivani,I was so glad when we shifted to our new house because it was so close to this place! This is our favourite breakfast place on a lazy day especially when we are hungover. The Eggs Benedict with salmon is my favourite. Our visit to cafe Eclat is never complete without eating the amazing french toast! Do try it and you would cherish every single bite! I hardly have pictures because as soon as the food arrives we just attack! The one I have attached was taken to make my sister jealous :),5,"14 Reviews , 5 Followers",4/11/2019 15:30,1,
Cafe Eclat,Anil Rao,I ordered from this establishment many times in the past - and all the food was quite good - perhaps unlike anything in Hyderabad.  But today I wished to have the traditional Fish & Chips served in English and Irish pubs in the UK and America.  Theirs is Batter Dipped unlike other (sometimes more expensive) places - and when one adds vinegar and salt to the fish in lieu of the tartar sauce provided (this is really hard  to get right in India in any case)- the result was a delicious facsimile.,5,9 Reviews,4/7/2019 18:15,0,
Cafe Eclat,Shafia Shams,"This place has one of the most amazing menu , great choices from pasta,burgers,breakfast option,in house made desserts and customized Gelato.
 The most interesting part is that has an open viewing kitchen where we can see freshly prepared bakery items,tarts and macaroons which will leave you wanting for more . Plus great Hygiene condition maintained by the kitchen staff.I have been here for breakfast and had English paneer tikka sandwich and iced latte. The quality of bread used is really one of the best.

Would love to visit this place again just to try the yummy spread of desserts and gelato.",4,"95 Reviews , 299 Followers",3/30/2019 20:26,0,
Cafe Eclat,Ayush Khatri,"I had a real craving for a chocolate and ordered Death by Chocolate cake and Quadruple Swiss Chocolate Cookie.
Cookie was pretty awesome and would definitely recommend trying(though it's pretty small) . Death by Chocolate cake was not fresh, and had that sugary texture to it. It was really disappointing.",2,"4 Reviews , 110 Followers",3/24/2019 23:53,0,
Cafe Eclat,Sankeerth Das,"So I’ve been to this place with a couple of friends for breakfast, so I’d say that their bakery items are out of the world. Freshly baked and you can see the chefs preparing them through a transparent glass.
Breakfast wasn’t great, would give it a 2/5
They use their own recipes and sauces.
Also, most importantly it’s a big hole to your pocket. Very expensive. So watch out",3,"3 Reviews , 8 Followers",3/17/2019 23:27,0,
Cafe Eclat,Anoop Prakash,"Boy do I love their bakery products, especially their fresh bread. That whole wheat bread is to die for. 170 bucks, 3 times as expensive as one from old Madras baking company, but 3 times better in taste as well.

They have a nice quiet small seating area which serves fresh continental, and desserts. I loved the quattro fromaggi, as it was made from fresh sourdough bread.

The only reason they lost a star is their high pricing on pastries (400 bucks for a cheesecake for example) and average cafe latte. But am a frequent customer here nonetheless, some guilty pleasures of life.",4,"112 Reviews , 450 Followers",3/7/2019 8:39,0,
Cafe Eclat,Preethi Pusarla,"This place serves frozen food mostly. They just reheat the food and give it you.
Liked the cinnamon roll over there.
We ordered Pasta and it was just fine.
And yeah it is expensive.",3,"3 Reviews , 1 Follower",3/6/2019 19:52,0,
Cafe Eclat,Tejasvi Mohan,"Heard a lot about this cafe from my friends in Hyderabad. Located in Gachibowli it’s one pocket friendly continental cafe. I tried pizza, Mexican buns, sourdough bread sandwich, cappuccino and a death by chocolate cake. Pretty cool stuff, kitchen has a transparent facade makes it a little uncomfortable for the people sitting in right corner",4,"70 Reviews , 243 Followers",3/4/2019 17:04,4,
Cafe Eclat,Mounikagampa,"This place is near to my office. It is on the same building of playstreet, next to F45 and opp to plabo. During my cousin's visit to india, we used to visit this place for a coffee after dropping their kid at play school. I would like to review about the cake which we ordered during my cousins birthday. We are around 5. Ordered gluten free options like chicken sandwich, mango juice and a cake. I completely forgot the name of the cake but it is the best. Ambience is good. It is bit expensive.",5,"42 Reviews , 98 Followers",3/2/2019 14:49,8,
Cafe Eclat,Shiva Varma,I came here with my family last month we had a burger and taste is good and good place for family and friends and pleople can bring their children...,4,2 Reviews,2/21/2019 21:53,0,
Cafe Eclat,Tavleen Kaur Gandhi,"Just happened to be here today. Coffees are a try out. Caramel and hazelnut latte are good. Vanilla latte is average.
Coming to starters fish and chips can be tried out. Shepard's pie seems good but is costly. Chicken quiche is not good at all. Don't try.
Desserts are good specially croissants.",3,"111 Reviews , 568 Followers",2/10/2019 0:41,2,
Cafe Eclat,Manisha Dash,"Situated at one of the prime locations, éclat was an average experience. Ambience is good and service was decent (guess they did not have many servers on that day). The dessert we ordered was good but the chicken steak and burger were made of frozen chicken which was extremely chewy. Beverages were decent. Had heard a lot about the place but overall would rate it as just 3.",3,"24 Reviews , 6 Followers",2/8/2019 19:22,0,
Cafe Eclat,Swati Sk,"This is quite a cute little cafe.. The food here is delicious although the prices could have been a tad less.. loved the French toast here.. Had the chicken panini here.. the paninoli bread was quite hard..
You can see your food being prepared here...",4,"64 Reviews , 202 Followers",2/6/2019 15:53,7,
Cafe Eclat,Debabrati Sonia,My favourite cafe around gachibowli. A little overpriced but worth the taste and service. Tiramisu cupcake is a must try over here.. Fresh baked breads are preservetive free and really fresh..,5,"15 Reviews , 13 Followers",2/3/2019 18:28,3,
Cafe Eclat,Ashima Singh,"Staffs were polite.
Cafe is cute and small. Very cozy and comfy. Good for catching up with friends and date sort of.
A little over price.
Could have better food menu.",3,"14 Reviews , 12 Followers",2/3/2019 13:21,0,
Cafe Eclat,Prawal Agarwal,"Went there on a Sunday evening with the intention of having just a coffee and relax - as you do in a cafe. This review is not going to be about the food taste and quality and ambiance (which is good as reviewed by numerous others) but a different thing which bothered me once I started going through the menu - how expensive the place is! I have been to swanky places in 5 star hotels, but they are expensive because they are IN 5 star hotels. This place is at an ordinary location with very ordinary ambiance. Could never figure why my coffee was 300 bucks and the cheese cake slice 400.
Taste - 4 stars
Value For Money - 2 star
Overall - 3 stars",3,"7 Reviews , 110 Followers",1/28/2019 15:11,1,
Cafe Eclat,Prasannarao2011,"Extremely happy with the food. It’s the 5th time we have been there and the taste, ambience and service is just great. Specifically Srinath who practically runs it is too humble and hospitable. Great service, food and ambience. Don’t miss it !",5,1 Review,1/27/2019 20:41,0,
Cafe Eclat,Rohit Kumar Gupta,"We ordered eggs benedict and American pancakes. Liked a lot, both of them but they should also serve hash browns with the pancakes as the pancakes are small and the portion size was less. The seats were uncomfortable. They should have provided cushions in each chair, as the seats are quite deep and it doesn't provides good back support. But, food was very nice. Highly recommended!",4,"36 Reviews , 153 Followers",1/13/2019 11:39,1,
Cafe Eclat,Bozy Chabungbam,Cafe eclat is a warm and cozy place which has quite a lot to offer for those who love dessert. The raspberry jam donut was good but the chocolate ganache tart wasn't really upto the expectation when one tart costs RS 150. Overall a good place to spend good time with friends for coffee but could be little over priced if the right item is not ordered,4,"2 Reviews , 37 Followers",1/7/2019 21:35,1,
Cafe Eclat,Debangana Tarafdar,"This place is located on the Gachibowli Highway.

I loved the ambience, food and service.

Everything we ordered was delicious. It makes for an amazing breakfast/ brunch place.

We ordered a Chicken Sausage Roll, English Lamb Panini and Spanish Omelette with Hash Browns.
We also had a Roasted Pineapple Yogurt Smoothie.

The Sausage was lovely, and I loved the dressing on the salad. The meat in the panini was extremely well cooked.

The Smoothie had a zing, and was very refreshing.

I loved Cafe Eclat, and I look forward to visit again, to try the rest of the bakery items.",5,"117 Reviews , 980 Followers",1/6/2019 16:24,0,
Cafe Eclat,Raja Srivathsav,"Ambience: 3.5
Food: 4
Service: 4

What I ordered?
Goat cheese and pesto sandwich (amazing taste, average pesto)
Broccoli and sweet corn turnover (broccoli was kinda over cocked)
Caramel donut
Latte, a Mocha and Hot Swiss chocolate (the best thing I’ve had today)

Will I visit this place again: Yes",4,"43 Reviews , 93 Followers",1/1/2019 22:21,3,
Cafe Eclat,Ankit Bishnu Dash,"Hey friends, I visited cafe eclat on 31st December 2018 with my office colleagues and they treated us very well.

We ordered pizza, nachos, banana ginger milkshake, and many other items.

The service is quite good and staffs are well trained.

The place is nice and cozy.

I recommend this place for everyone.

Food -5/5
Service -4/5
Ambiance -4/5",5,"47 Reviews , 1509 Followers",12/31/2018 19:06,4,
Cafe Eclat,Sweni Tolia,Just happen to stop by this cafe on the roadside.Amazing cafe at a prime location. Food is really tasty m coffee was amazing. Little overrated n over priced.,4,"9 Reviews , 77 Followers",12/29/2018 22:18,1,
Cafe Eclat,Amitav Mohanty,"This place has been a favourite since it started. I remember the early days when it was building its repute. One evening, they were asking folks to try out their macaroons to get feedback. Over time, they have established themselves as an authentic place for baked items.
Their croissant is quite good. They are actually one of the few places I would trust ordering a croissant from. They also make tarts and quiches. Their pasta is quite good. Even their cinnamon roll is lovely. If you want good breads, they have a good variety, from sourdough to German rye.",5,"31 Reviews , 36 Followers",12/24/2018 3:02,0,
Cafe Eclat,Anusha Sankar,"I recommend their bread. A bit on the expensive side, but really good quality! We bought their wholewheat raisins and walnut bread and were really impressed.",4,"38 Reviews , 111 Followers",12/6/2018 10:45,0,
Cafe Eclat,Sandeep Srivastava,"Superb quality, service and ambience.. can customise their dishes, fresh bakery and healthy salad items just makes the best place for any kind of outing..",5,"20 Reviews , 123 Followers",12/2/2018 5:52,0,
Cafe Eclat,Aditya Kumar,"I had visited this place on a week day. We ordered red sauce pasta and lemon drizzle. It was good, but the taste was not extraordinary, i felt this place overly priced. The cafe says that it uses all kind of organic veggies and cheese, but i felt the price they were charging was exhorbant.",3,"12 Reviews , 2 Followers",11/26/2018 17:41,0,
Cafe Eclat,Vemulapalli Sharmista,"Perfect location for your English Breakfast.. Everything is baked on their own and you can actually feel the taste of it.Must try the Gelato of any flavour.
Scrambled Eggs - Too good to have
Waffles-Yum
Potato wedges- Hot and Crispy",4,"64 Reviews , 142 Followers",11/24/2018 14:21,6,
Cafe Eclat,Sharon,"I love their bakes! Cakes, cupcakes, croissants, gelato and everything! Their cheesecake is heavenly especially with the in house-made tart strawberry sauce on top. Special kudos to the lemon cupcakes!
I've never ordered anything savoury from them because of poor impulse control. 🤷",5,"20 Reviews , 81 Followers",11/20/2018 21:36,0,
Cafe Eclat,Sudheer Bandaru,"The only place to find best bagels or any bread for that matter. They take food so seriously to deliver the best! Our kids love this place and want to go there every weekend!!!!
Want to see more locations.",5,"3 Reviews , 1 Follower",11/18/2018 9:16,0,
Cafe Eclat,Sainikelash Jammula,"Excellent Place to Be and Food is very hygiene and good
Serving is very warm and nice.
Good Place to hang out with Family and Friend’s.
A Must Visit Place.",5,"8 Reviews , 216 Followers",11/14/2018 17:49,0,
Cafe Eclat,Sandeep Pendurthy,"Restricted to order just eggs due to diet plan, the Spanish omelette was very well made. The selection on the menu looked tempting and the bread and dessert counter had a great variety to offer. The Coffee was good and service very efficient and warm.",4,"63 Reviews , 163 Followers",10/24/2018 9:58,0,
Cafe Eclat,Sairam Bongu,"The best smoked salmon of Hyderabad!

Order’s & rating’s

- smoked salmon Croissant - 4.5/5
- mushroom melt - 4/5
- Smoked salmon bagel - 3.5/5
- prawn croissant - 4.5/5
- Swiss hot chocolate - 3.5/5",5,"4 Reviews , 62 Followers",10/23/2018 17:56,0,
Cafe Eclat,Ananya Pani,"We ordered for a margarita pizza, a brocolli-corn puff, a spinach corn sandwich, a blueberry shake, an icy latte and few cappuccinos . Apart from the cappuccinos nothing else tasted good. The bread was hard, the puff was slathered with butter, the icy latte was tasteless. The food is extremely overpriced compared to the sub standard taste.",2,"6 Reviews , 6 Followers",10/13/2018 21:26,0,
Cafe Eclat,Ankana Chakraborty,"As a compulsive dessert and bread hogger, I was logically drawn towards the menu of this place. And it didn't disappoint.

If you are looking for a doughnut, please move away from those factory line produced, dense, overtly sweet and miserly filled ones. (It's about time they dunk themselves in a pot of acid.) Eclat's doughnuts are exactly what the deep fried yet fluffy bites of joy should be. The Berliners are generously filled and are light enough not to stick to your teeth.

The New York Cheesecake is one of the best I've had in terms of texture. It's rich and flaky when the fork hits it and absolutely melts as soon as it touches your tongue. I do recommend cutting back on the cinnamon a tad bit to ensure it allows the flavours of the cheese to shine through.

The chocolate cake is decadent and comfortably ranks one among the best in the city. The key lime tart is full of flavour with the right balance of tang and sweet.

The taste of the dishes confirms the use of good quality ingredients and an understanding of the technic needed to churn out great products. Keep it up.",4,"10 Reviews , 8 Followers",10/10/2018 16:32,0,
Cafe Eclat,Deepthi Karnam,"A small hygiene place with comfortable seating. The desserts and coffee are absolutely tasty :) we tried the Italian bread sandwich, that was yum",4,"16 Reviews , 33 Followers",10/8/2018 12:41,1,
Cafe Eclat,Rupak Thummala,The food is good but not worth the huge price. Mexican bun - not good. It had a strong coffee flavor and was also a little burnt. Coffee is average. Tables and cutlery need to be cleaner.,2,"9 Reviews , 41 Followers",10/2/2018 20:00,0,
Cafe Eclat,Saurav Srivastava,"My wife loves the tiramisu here though priced higher than what I would have expected. We also ordered a pizza which was good given they make it fresh and you can see the whole process if you take a seat at the back. I liked the coffee, strong.",4,"54 Reviews , 271 Followers",10/2/2018 9:29,0,
Cafe Eclat,Subhayan Foodie Basu,"Location: Prominently located just opposite to south india shopping mall

Ambience: Simple yet funky designer interiors. Small yet comfortable sitting area.. good place for grab a coffee

Food: Ordered there spcl thin crust pizza
Which was really awesome .

Death by chocolate: its an awesome combination of choclate n cream which blow u away


Overall a good place to hang out",4,"71 Reviews , 328 Followers",9/30/2018 15:52,6,
Cafe Eclat,Suraj Shenoy,"We went in as a group and it is a small place and they had to arrange the tables awkwardly. So it is definitely not a good place for groups.

The food was below par. The worst part was that the chicken starter they served was not cooked. The mushroom toast was not good too. The sandwich, burger and pizza was also below average tasting. They also didn't have bottled water.

Only good thing was the friendly service.",1,"119 Reviews , 598 Followers",9/29/2018 0:37,0,
Cafe Eclat,Pathakastha666,"Cafe eclat has lot of variety and their white sauce pasta is delicious. But majority of the food lacks taste, french fries lack seasoning and sandwiches are dry. Moreover, i find the place way expensive for the experience offered. I would recommend to go here for cold coffee or chocolate shake.",3,"41 Reviews , 34 Followers",9/25/2018 0:18,0,
Cafe Eclat,Akhilesh Heda,"Amezing place if you are looking for a relaxed time with some food and good coffee. Been there on Saturday night. The place is quite and well maintained. Staff is awesome with fast service. Tried some desserts along with sendwich and coffee , the taste was amezing.
Would say a must try place.",4,"7 Reviews , 61 Followers",9/12/2018 0:23,2,
Cafe Eclat,Anoop Madamsetty,Awesome breakfast place...nice ambiance...cozy..only downside is that it is very expensive..prizes could be a tad less.. service was quick..,4,"6 Reviews , 186 Followers",9/8/2018 18:57,1,
Cafe Eclat,ధర్మపురి హరీష్,"Cafe Eclat is a place where I can find best food in Hyderabad,one of my favorites are pizzas, omelets,and tiramisu.i have problem with their setting.everytime I go the corner table is reserved.this time i waited for two hours on other table.i noticed that lady who was taking the bills had came and having food. I don't know why this is happening with this good place.this was unexpected.over all ratting
Food -5/5
Service -2/5
Ambience-4/5",4,"1 Review , 2 Followers",9/8/2018 15:06,0,
Cafe Eclat,Chhaya Sharma,"I don't know why this place is rated 3.9, it easily qualifies for 4.2 and above.
We ordered a Farmers omlette, masala omlette, american panacake, banana ginger milkshake and a caramel coffee.

Farmers omlette was the best dish out of everything, pancakes melt in the mouth and the combination of banana and ginger just works.

I would love to come back to this place and recommend others to try out.",5,"1 Review , 48 Followers",9/1/2018 12:06,0,
Cafe Eclat,Poojitha Challagali,"Ambience - 4*
Service - 3*
Food - 2*
It’s a good place to hangout. But get your hands only on the items in display rather than ordering from the Menu.
Not a place for people who love spice.",2,"5 Reviews , 15 Followers",8/27/2018 15:03,0,
