Restaurant,Reviewer,Review,Rating,Metadata,Time,Pictures,7514
The Glass Onion,Varun Kuhad,"Yesterday I was here with my two friends, it was raining and weather was amazing. The best fusion food I could ever eat. It's a must go place guys, I would rather say best place for romantic couples, good view, ambience of the restaurant, good yummy yummy food and silent music. The manager and people who were serving here are so polite and humble to suggest food and drinks. I would like to visit again soon.
😍😍😍",5,"4 Reviews , 122 Followers",5/21/2019 12:23,6,
The Glass Onion,Dharma Teja Alaparthi,"I liked the food very much. The best part is the ambience of it, you cannot ask for a better one in Hyderabad. It is so peaceful and one could spend hours sitting there. We had a hard time finding parking spot as the parking is full. Other than that, I loved this place and would go there again and again!",4,"34 Reviews , 55 Followers",5/20/2019 13:15,0,
The Glass Onion,Shashant Singh,The ambience was very calm and soothing. Great view from the outdoor deck. Service was prompt by our server Mr. Anup. Food was absolutely delicious!! I recommend this place to try!,4,"1 Review , 73 Followers",5/19/2019 19:34,0,
The Glass Onion,Manika Paliwal,"It is a great place for a quiet dinner and ambience is lovely but the food was a disappointment.
the place doesn't feel like we are inside the noisy city which is absolutely delightful, but I wish I could say the same about the food and drinks!!
staff is courteous and serving time is excellent, you don't have to wait for your food or drinks for more than 10-15 mins no matter what you order.
Ambience: 5/5
Staff; 4.5/5
Food: 1/5",3,"3 Reviews , 3 Followers",5/19/2019 15:35,0,
The Glass Onion,Madhusha Urlam,"Surprisingly the Sunset was an eye fiest. Evenings can be well spent. Feels like not in the City anymore. Quite peaceful and lovely ambience 🤩
Food is little disappointing though. Chicken is not at all spicy. But the Apricot Delight is a must try.
Go....have the most of the place with an Apricot Delight is what I can give 5/5 😛",3,"27 Reviews , 87 Followers",5/19/2019 11:30,4,
The Glass Onion,Ashish Paul,"This was place was a surprise as it is better than you imagine. Though it turned out to be a bit hot, the air circulation could have been better. The food and drinks were as how they were described. Must try.",4,6 Reviews,5/17/2019 2:13,0,
The Glass Onion,Arjun,"The Glass Onion is located at a calm and a quiet place. Despite being around a km behind Infosys, the place gives it an advantage of switching away from city chaos and you needn't be bothered about finding a place for parking. While the restaurant does offer valet, but the parking area next to the restaurant is huge and you can easily get a place there.

Once you enter the restaurant you're floored by the grandness of the place as it comes as something unexpected. They have both indoor and outdoor seating arrangements. Owing to the summers, we opted for indoor seating. The tables are well spaced and there's enough distance between the adjacent tables to give you a premium experience.

The servers are well groomed, attentive and make good recommendations basis the specialities of the restaurant and after checking your preference. For starters we ordered Lotus Stem Galouti Kebab and Nachos. The Kebabs were well cooked and though a little spicy left a good after taste. The Nachos were light, crispy and had good amount of toppings. Despite Nachos being one of the common starters, I'd still recommend people to try the ones here.

For the main course we ordered the Lahori Paneer Combo that gets served with a small bowl of Dal Makhni and Naan/Pulao. The Paneer too tasted very good and had the right amount of spices which blended well with the Paneer. The Dal Makhni that came along with the Paneer was out of this world. It's a pity that it doesn't get served separately, but upon request the servers certainly obliged by offering another small bowl of the same. For something that's prepared so well, I feel that the patrons should get to taste more of it and would request the management of the restaurant to include it in their menu.

Finally the dessert. Tiramisu pastry. Simply no words. Right amount of sweetness, well blended flavour and that smooth after taste of coffee. After a good dinner, the Tiramisu sealed the deal for us to be one completely satisfied customers.

One small observation that I'd still like to add is that despite a good number of servers, they tend to get distracted and slightly inefficient when all the tables start getting full. Towards the end we had to remind them about the dessert and it was evident that they had missed bringing it. However considering that they were attentive and friendly for most of our time there, I wouldn't penalize the restaurant with a star but would request to keep a check on the observation and continue to maintain the quality of the food to keep ensuring repeat visits.",5,"266 Reviews , 1559 Followers",5/12/2019 18:36,7,
The Glass Onion,Mr. Ego,"Truly a hidden gem. This place is situated far from the city, inside Emaar courtyard. The have both indoor and outdoor seating, and the ambience is the best part about this place. Its just amazing.
The food was also great. Something that good be improved is the customer service. There is a bit of delay in getting the orders.
Top Picks :
- Mint Cooler
- Chicken BBQ Pizza

The ambience will offset the price you pay. Overall, a must visit place.",5,"57 Reviews , 513 Followers",5/12/2019 16:32,4,
The Glass Onion,The Hungry Turtle,"This place looks really nice with some good music. They have both outdoor and indoor seating facility and it's a best place to hangout with the family and friends. Outdoor seating has an amazing view of the Golf ground and can be enjoyed during evening.

They welcomed us with a welcome drink which was really nice.
First we ordered Screw Driver, Tropical Delight and Mint Cooler which was really good.

Screw Driver - It was a Cocktail which contains Vodka and Orange juice.

Tropical Delight - It had Orange, Pineapple, Mango and cream which taste differently. I personally liked that blend but my friends didn't. I would rate 3.8/5.

Mint Cooler - It is just normal Virgin Mojito what we gets in other places as well. Nothing special was not their. 3.5/5

For Starters we ordered Lotus Stem Galouti which was ok ok. The kulcha was bit hard so that we need to chew it more. 3.4/5

Next we ordered BBQ Roasted Chicken pizza which was good. The pizza was properly cooked but bit burned at the end which can happen. But that was covered by the taste. 4/5

Overall the experience was really good and it is located in a calm area where we can sit and enjoy with our kids or family or friends.

Overall - 4.6/5",5,"1 Review , 2 Followers",5/12/2019 15:58,6,
The Glass Onion,Pragati Magham,"The place was in a very high end location. The ambience was not up to the mark. The service seemed pretty hostile when we asked them basic questions. And when we asked them to pack some of the remaining food, they didn't seem too happy about it. The appetizers and soup were good, but the quantity was too little. We ordered the ""Classic Mezeh Platter"" and when asked for some pita bread, the waiters frowned upon us and did not give us an appropriate response. Overall the place is overpriced and the service needs to be improved.",2,"2 Reviews , 6 Followers",5/12/2019 8:38,0,
The Glass Onion,Gaurav Agrawal,"Visited glass onion a month back. The restaurant is very close to office, inside premises of Emmar boulder hills. We went with office colleagues on a celebration treat.

Ambience was really good. We had experience of both indoor and outdoor dining. Outdoor dining truly outscored indoor experience.

Food was good but a bit higher on the price looking at portion size. We ordered Mediterranean platter, Bruschetta for vegetarians. The mocktails were nice.

It was couple of days before elections and apparently alcohol was not to be served. What really impressed me was that they followed rules. That's really good to see.

For main course we ordered a north indian combo, a very customised pasta and couple more things. They tasted good. Deserts were good but served delayed.

Overall nice experience.",4,"3 Reviews , 2 Followers",5/12/2019 5:13,0,
The Glass Onion,Saurabh Pareek,"Place is cozy, peaceful and beautiful. Food is 4.5/5. Ambiance 5/5. Service 4.5/5. Good place to visit with family, friends or team. We tried their special nachos, 5 spice chicken kebab and Atishi murg tikka.",5,"2 Reviews , 1 Follower",5/11/2019 23:07,1,
The Glass Onion,Jay Mehta,"2 stars for the place for rest 3, need good food, service, presentation and experience

Lets start with the good part for which the two stars.

Ambience , location and the place is amazing nothing like other places in hyd. The rain today made it even better. Outdoor has this chil lounge vibe with good house music and indoor being this good energy family or dinner vibe.

Thats it to the place and good part!

Service was bad, food was ok. If a restaurant does not serve filter water it is a huge problem. Buying water is a choice not force. Doesn’t matter if you are local udipi or a five star. We were told we dont have filter water something is broken so you buy. While leaving we did see other tables served normal water.

We did have zomato gold to use, but the experience was not so great to use it. First turnoff , dont have kingfisher beers.

We ordered veg tandoor platter, margherita pizza , tiramisu and cheesecake.

Pizza was the best part and yet i would say a 3.5/5. Generous amount of sauce and cheese but 3 basil leaf to count. We asked for mustard and denied.

The platter had many things but of of which was paneer tikka n no grilled onion or peppers or tomato. Whole platter didnt come with any onion et al side. Extra chutney took forever to come.

Tiramisu was average will not try again or recommend

Cheesecake was pretty bad. Packed to throw i guess. The blueberry on it ...is red color which is super confusing. The creamcheese itself i would guess will be cheaper kind making it hard.

They gave a birthday brownie, Which frankly was average too. However, the server comes and tells me during payment, i have not charged you for brownie. WTF!!!!!

Overall i will recommend to go to njoy the place and have few drinks. Hop to jonathans for food or some place in indiranagar.",2,"46 Reviews , 43 Followers",5/11/2019 22:12,6,
The Glass Onion,Divya,"A classy place with fantastic ambience.The decor was lovely. A perfect place with indoor and outdoor seating options. Ordered Chicken wings- which were perfectly cooked with the right amount of flavours infused. Tempura prawns were okay. Can give it a miss. Lotus stem galouti kabab- mildly spiced, well cooked and melts in the mouth. Ordered Chettinad chicken Indian tray. It was amazing! Sundried tomatoes chicken pasta was made perfectly. Ordered Goey chocolate brownie with vanilla ice cream and tiramisu. Both of them were perfect.
VFM : 3.5/5
Service : 4/5
Food quality : 4/5
Ambience : 5/5
Music : 3/5 ( in the indoor seating area the music was too loud )",4,"8 Reviews , 6 Followers",5/11/2019 21:27,9,
The Glass Onion,Rwitaja Banerjee,"“All four elements were happening in equal measure - the cuisine, the wine, the service, and the overall ambience. It taught me that dining could happen at a spiritual level.” #food #foodporn #instagood #love #photooftheday #foodie #follow #picoftheday #instafood #amazing #smile #style #instadaily #followme #like4like #instalike #girl #foodstagram #foodgasm #fashion #yummy #igers #art #friends #swag #fun #bestoftheday #follow4follow #foodphotography #tweegram",5,"13 Reviews , 37 Followers",5/11/2019 0:19,2,
The Glass Onion,Shubham Gupta,"Great ambience, awesome cocktails, delicious food, fabulous service. What more do you need from a place. Music could have been better. Recommend Pennicilin for Whiskey lovers",4,"25 Reviews , 135 Followers",5/8/2019 22:42,0,
The Glass Onion,Sasha,"The best pizza I have ever had !! You will fall in love with the space, a perfect place for romantic dinners and desserts you would crave them even later with the thought of them! Though the food is a bit expensive , it is all worth it!!",5,"2 Reviews , 2 Followers",5/5/2019 22:50,0,
The Glass Onion,ARJUN KAKKAR,"Nice place to hangout with friends. Light Dj music. Good variety of fruit beverages. Margherita pizza is a must try. Chicken wings, chicken risotto and cheese broccoli",4,"11 Reviews , 41 Followers",5/5/2019 18:55,0,
The Glass Onion,Ashish Sharma,"A memorable experience- would be the right caption for my recent dining experience with this restaurant. Staff was very courteous & proactive (special mention:- ankit & vishal). The restaurant has breathtaking views of the golf course around. The interior designing is another remarkable thing to notice.
Last but not the least - ‘The Food’
I can still recall the tempting taste left on my tastebuds while stepped out that night.
MUST VISIT!! M definately coming back😍",5,"1 Review , 25 Followers",5/5/2019 17:09,0,
The Glass Onion,Bhushan Maideo,"I went there with my office colleagues. The ambience is good. The music played is little loud, may be volume can be reduced a bit so that we do not need to about while speaking.

About food, quality of food is good, but waiters need to be taught that when four people order two different dishes, all those to be served at same time. What happens was, we two finished out veg food and the nob veg waa not even delivered when we finished our veg food.

We ordered Lotus stem Galouti, the taste of Galouti was good, but keeping one small kulcha was not going well. I know it must be an experiment, but I guess it is not working out as it was not going well with Galouti.

So, overall, good for one time.",3,"4 Reviews , 8 Followers",5/5/2019 12:35,0,
The Glass Onion,Vibhor Dhote,"I really like this place and I've been there multiple times. The best part is the ambience which is just really classy. You can bring your date here as they have that kind of a romantic ambience. On game nights you can watch live screenings of the matches too. They also have 2+2 on drinks for Zomato gold members, which is really nice to have as well.",5,"63 Reviews , 260 Followers",5/4/2019 20:38,0,
The Glass Onion,Ganachariruchira,"Had been here for lunch.
An amazing ambiance.
I tried the Italian cuisine.
My most favourite was the spinach ravioli, the best ravioli I have ever had.
Food - 5/5
Ambiance- 4/5
Cost- 4/5",5,"1 Review , 2 Followers",5/4/2019 18:55,0,
The Glass Onion,Pori Goswami,"Talk about a perfect date night and The Glass Onion is the best decision to go for. With amazing music, perfect view of the golf course, beautiful seating arrangements and sophisticated ambience made the night worth remembering. The New York cheesecake (with blueberry sauce) was good, but I won't deny that I have tasted better cheesecakes before. We ordered one pizza which, was quite filling and with generous amount of smoked and mozzarella cheese was enough for two. Special shoutout to the manager and the head waiter (I apologize I don't remember his name, but he definitely needs some appreciation. I remember he said he was from Delhi and also Kolkata) who was very courteous and offered us a complementary dessert. This definitely made our night because it tasted so good. The menu might be little overpriced according to many but for us with smart selection of dishes, it was not a hole in the pocket. Overall, it was an outstanding visit. A small suggestion, if they could include candle dining,that would elevate the romantic ambience of the place.",5,"6 Reviews , 46 Followers",5/4/2019 17:14,2,
The Glass Onion,Harshet Agarwal,"great feel, great ambianceterrible customer serviceU need a mesh and anti mosquito repellents ASAPwould not really want to be back after such an experience here
the food was decent though",3,"34 Reviews , 36 Followers",5/4/2019 15:50,0,
The Glass Onion,Sainath Reddy,"Best place to visit in winter nights. But summer mai not so good for dinners.
Ambience-4.5
Food-4
Service-5
Will try to visit for Lunch in summers for the golf course view.",5,"3 Reviews , 212 Followers",5/4/2019 14:15,0,
The Glass Onion,Dheeraj,"One of the best place to hangout with group of friends & colleagues ! ✌️
Continental food was delicious 😋
Good ambience and great staff 👌
Had an awesome day with my dearest friends 🥂🍱",4,"7 Reviews , 6 Followers",5/4/2019 13:00,0,
The Glass Onion,Sandeep Sahoo,There were mosquitoes in the restaurant. The food was ok but there was a hygiene concern. The pickled carrot was stale and had fungus. The waiter replaced it but this is not expected of such a high profile restaurant.,2,"2 Reviews , 79 Followers",5/1/2019 23:24,0,
The Glass Onion,Avinash Agarwal,"The food is decent but the place and service is extremely horrible. Went there for dinner with my family and we were bombarded with mosquitoes all around us, even though we were sitting indoors. Called the manager for this situation and was told that they can't do anything about it. Brilliant customer service!",1,"2 Reviews , 22 Followers",5/1/2019 21:55,0,
The Glass Onion,Arpita,Avoid this place in summer due to outside seating. They do not even have coolers in such weather outside and it is an expensive place. Not worth,1,"6 Reviews , 14 Followers",4/29/2019 18:40,0,
The Glass Onion,Gautam,"We visited the restaurant yesterday. We got outside table as all insides were reserved. Being 42 degrees outside, they only had fans running in such upscale restaurant and mist fans. They are charging 1400 RS for buffet and is considered upscale restaurant. Quite amazed on how upscale restaurants cannot afford coolers. Felt bad for waiters also as they were fully sweating and running around..I had same experience few months back. We went in th evening and it rained. We took the outside seating due to nice weather plus all the water was gushing inside and they had nothing to prevent that. I liked the food here but if management can't simply think abt service, I am sure we can figure out other places to eat.",2,"4 Reviews , 3 Followers",4/29/2019 18:31,0,
The Glass Onion,Richa Kulshrestha,"Why Glass Onion 🍚🍚: This place was trending on zomato ever since it has openned and it has gained the popularity in very short span of time. So, I was having an eye on it and finally felt delighted after visiting it at Saturday Night🌙.

Ambience⛲ : Oh Wobby !😍 Beautify ambience with indoor/outdoor sitting options and spread accross huge space. Its situated inside the boulder hills and hence the area is very peaceful and calm. You need to have a reservation for outdoors as this place is mostly filled with people

Service & Food : Super fast service and sumptous food. Period.
From Kung pow chicken , cheese based brocolli to Nachos to chicken chettinad , everything is lovely and you can go on asking more and more...😌

Yay or Nay : 👍👍👍",5,"98 Reviews , 581 Followers",4/29/2019 13:04,10,
The Glass Onion,Amrit Acharya,"I must say , Ambience is quite exotic and fancy. Food was well prepared . Have ordered different cuisines out of which Dan Dan noodles outshined. And in drinks the star was Afternoon fizz for us.

Ambience - 4/5
Food - 3.7/5
Service - 4/5
Location - 4/5",4,"9 Reviews , 8 Followers",4/28/2019 23:27,4,
The Glass Onion,Chen Reddy Sundeep,"Can improve your main course and desserts spread. I would have rated 3 but I am giving a 1 because one of your servers' behavior was bad in our office party. When my friend asked for a blue lagoon, he insulted him in front of everybody by saying that blue lagoon is for kids, not men... just because it's a soft drink. One need not believe in others' beliefs and customs, but at least respect them and not insult them. Train your staff appropriately.",1,"1 Review , 23 Followers",4/27/2019 16:03,0,
The Glass Onion,Chandann Reddy,Fantastic ambience and great service.... location is a must visit over seeing the golf course!!!! The food was great and meats quality was just superb..... will be a regular here!!!!,5,"302 Reviews , 228 Followers",4/27/2019 0:43,0,
The Glass Onion,Nidhi Gupta,"First time experience at this place was very good. Nice ambience, right from entry to the different seating areas offering different kind of ambiences. The food we ordered was also tasty. We had the veg Mezze platter and kungpao chicken as starters. Both were well made though quantity could have been a little more for the price they charge!
The main course was a custom made ravioli pasta in mixed sauce which was very good and a stir fry veg Udon noodles.

They can improve on service a bit as no one bothered to serve us food..not even first time!

Would like to go back again to enjoy the outdoor ambience next time where they played loud music..but looked like a good place to relax..",4,"13 Reviews , 24 Followers",4/25/2019 9:53,0,
The Glass Onion,Debashish Ray,"Awesome food, great ambience, best service.

We went in a group and tried a lot of things on their menu, everything was unique and best. Cocktails were decent. Stallion stood out of all!",5,"3 Reviews , 42 Followers",4/24/2019 23:35,0,
The Glass Onion,Amlan Jena,"I will start off by talking about it's ambience and location which I believe (and am sure most will agree) are it's highlights. Located inside the serenity of Boulder hills ,away from the hullabaloo of the busy city ,it offers a sense of calm. The simple yet elegant decor , is what clicked for me right from the moment I walked in. It has both and indoor and outdoor sitting. The indoor sitting though comfortable and well lit, I would suggest the outdoor one simply because of the view it has to offer. The streches of green pasture of the golf club adjacent to it and the mild breeze that blows across it , definitely refreshes your soul as you sit sipping on your drink. I visited it on a summer evening and it was a pleasant experience to say the least. Now coming to the food and beverages part, definitely a little on the bulkier side but you got to expect that from a place like this located in the midst of all VIP locality . The cocktails are good and do ask the waiter for in house food specialities which may not be mentioned in the menu. And yes they have a novel concept of High tea served along with alcoholic beverages , which is served during the early hours of the evening (4-7 pm) , with the set up they have I believe this is a must try. Overall it's a nice place to spend a quiet afternoon or evening , with family or friends.

P.S. Don't go there looking for dance and high pitch music, you might be disappointed.",4,"5 Reviews , 55 Followers",4/24/2019 23:10,0,
The Glass Onion,Vikhyat Khosla,"I don’t see how this place can be rated anything other than 5 stars.
Food, ambience and service, is awesome. There is no comparison to this place in Hyderabad.

I’ve been served by Ani, he takes care of customers and suggests great choices from the menu.

Personal favourites - broccoli cheese kebab. Non veg kebab platter. Mezze platter.",5,"2 Reviews , 46 Followers",4/23/2019 13:11,0,
The Glass Onion,Ramkesh Jhoorawat,"All great except the staff. The service is quite poor and they made a lot of fuss about using zomato gold.
Lots of mosquitoes. Staff won't care to put some mosquito repellant either.",1,"1 Review , 1 Follower",4/21/2019 20:50,0,
The Glass Onion,Eat Like Jo 👨🏻‍🍳,"As far as date nights are considered there is music, lovely ambience, tables over looking a golf course and of course some rains to give you respite from the hot summer. This was my dinner night with Naina at Glass Onion, a beautiful restaurant at Boulder Hills, Hyderabad. The best thing is definitely the vast lush green golf course which gives joy and you are definitely chilling out at the finest properties in Hyderabad.
.
Let’s take the food starting right off with beer battered fish and pizza it was all perfection at affordable rates. The beer battered fish was soft and finely fried. Lovely textures I must tell. Pizza was thin crusted and we chose a veggie pizza, called Four Cheese Pizza! Yea as you wonder it has all the right mix of different types of cheese and we just loved it. A classic wood fired pizza flocks!!
.
The penne had an attractive aroma when it reached our tables, and I must say I forgot to even take a better picture before we start digging in. It was delicious and completely uplifted the mood. We surely had our drinks to give us great company and must tell ya, the Stallion a whiskey based cocktail made with passion fruit, lemon juice and grapes were simply fantastic. Make sure to use your Zomato gold in good use here.
.
The cherry on top was Apple pie our parting order, such a warm dessert served with delicious custard sauce, almond praline topped of with vanilla flavoured icecream. We surely enjoyed this dinner and this place is a great find for couples to have a romantic dinner.
.
Ambience-5/5
Food-4.5/5
Service-4/5
Value for money-4.5/5",5,"212 Reviews , 524 Followers",4/21/2019 2:28,8,
The Glass Onion,Satyanarayan Reddy Konda,"The ambience is outstanding, we went in for dinner on a Saturday night. Book the table in advance. We ordered non veg platter and a Pizza with wines and beers. Food was good not great but the ambience is superb, serene backdrop and good music is all you need...",5,"1 Review , 1 Follower",4/20/2019 23:37,0,
The Glass Onion,Ragha Chaitanya,"5stars for the golf arena ambience and the cool breeze.
A must go place for those loving a break from the city huzzles.
Food is served good and the staff are accommodating.

However did not see any special cusines on 'Onion' as the name.suggests from glass onion.",5,"4 Reviews , 64 Followers",4/20/2019 7:54,1,
