Restaurant,Reviewer,Review,Rating,Metadata,Time,Pictures,7514
The Glass Onion,Nikhil Sirivolu,"What a beautiful place to go for dinner with family or friends! Headed to this place either friends for dinner and also for a special occasion.

There is both indoor and outdoor seating at this place. We chose to sit outside as it got a beautiful view and it was just amazing with the view and the weather.

There is quite a large selection of food from Italian, continental to Indian. We ordered for some starters from which we really like Bakchoy fry and also Malai Broccoli, chilli potato and Red chilli chicken were really nice and if you like to have some soup I would definitely suggest hi for Broccoli soup. For the Main course we ordered some White sauce pasta, Grilled chicken with Lemon Butter Garlic Sauce, Vegetarian Fried rice and my favorite Pork Spare Ribs which was just Scrumptious and beautifully cooked pork. We also ordered a cheese platter with wine and I would suggest this for the people who love to enjoy and cheese and wine.

We had less food and lot of alcohol but people who are going only to eat some food it’s really not that expensive and it’s totally worth it for the view and for the food.

A very serene beautiful and peaceful place to enjoy a beautiful evening!",5,"59 Reviews , 271 Followers",4/19/2019 15:22,2,
The Glass Onion,R Sai Kiran,Been to this place newly opened last week with friends. It's simply wow had a great view of golf course. Service is simply amazing specially Ankit and Vishal. It's a best place to hangout with friends in financial district.. 😊,5,"3 Reviews , 52 Followers",4/19/2019 15:07,0,
The Glass Onion,Aneesh Pahwa,"Amazing Ambience 💯♥️. Just love the vibes of the cafe. Hidden gem in busy place like gachibowli. Peaceful cafe. The food was also amazing.
Pizza 10/10 (wooden cooked)
Pasta 10/10 (one of the perfectly cooked cheese pasta I have had in hyderabad)
The drinks were also great and in short this place a must visit place. ♥️💯✌️🔥🍕",5,"12 Reviews , 1011 Followers",4/19/2019 0:21,7,
The Glass Onion,Puja Agarwal,"Perfect Place! For lunch/dinner/corporate parties/friends get together, in short, everything!

Ambience is lit. The place is super bright and it feels amazing being here.

Food- veg and non-veg, both were delicious.
Must try - Broccoli kebabs, Ravioli, Nachos.
Non- Veg: 5 spice kebab, prawns, Chicken tikka.

Service: staff was super friendly, They made the visit complete.

A Must visit one!",5,"32 Reviews , 265 Followers",4/17/2019 23:19,3,
The Glass Onion,Neetika Sahai,"I have been to this place for my birthday dinner date. One of my friend told me about this place. It has a nice view which is worth spending as it is bit overpriced place. If I'll talk about food, its not that great. The portion is also less for the price but if you want a nice place to spend your evening with your loved ones, you can try this place. Just go and relax because the food will take time to come..
Would have given 3.5...",4,"44 Reviews , 872 Followers",4/17/2019 23:10,6,
The Glass Onion,Garima Nahata,"So, this place is in Boulder hills and is spread across a huge area and the interiors is what one would love to go here for.

The seating arrangement is pretty and comfortable.

We had ordered pizza and vegetable Burger which was good In taste. The pizza could be improved a lot though.

We ordered noodles which was good in taste as well.

Overall, we had an amazing experience, cheers.",4,"110 Reviews , 1036 Followers",4/17/2019 17:35,12,
The Glass Onion,Shreya Matangi,"I visited this place with my ex-roommate after 10 months.
Low crowd made us feel even more comfortable.
Attractive and romantic ambience..
Tasty food and very much reasonable...
Good service..
I had chicken breast steaks with mashed potatoes and salad 😋 unexpectedly so good taste.
If you are a pasta lover, then do order white sauce pasta.
It tasted incredibly hot and yummy.
As we visited this place for lunch, we had afternoon fizz mocktail with chill coconut and very different flavors of taste.
We wrapped up having sea salt Nutella dessert which was heaven of Nutella and different taste.
In recent times I've never been to such a good place with decent crowd and tastyyyy food.
I agree that prices are high but I forgot about the price when I had one spoon of food.

Do visit this place with your loved ones I bet you will have a perfect date.",4,"13 Reviews , 22 Followers",4/17/2019 15:46,0,
The Glass Onion,Swati Babber,"Amazing ambience, whole experience was great. :)
Will come back again for breakfast, loved the view outside. Rice bowls are a must try. Broccoli Veg starter can be skipped.",4,"7 Reviews , 2 Followers",4/15/2019 23:29,0,
The Glass Onion,Sawan Suman,"Visited the place on a Saturday ! We had reservations made for 8pm and reached at around 8:20pm, only to receive a disapproving look by the lady and were told that it is difficult to hold a table this long! The entrance gave a deserted look and we were thinking why is this female so arrogant. Thereafter we got to know the real story as we moved towards the seating area. The place was well lit, with a posh ambience, perfect seating and tranquil yet charming environment. Really loved the idea of the hanging plants amidst the lights.
We ordered Lotus stem galauti kebab, kung paw chicken, teriyaki mushroom. The starters were delicious especially the chicken. Beware of the cocktail as you might be in for some surprises.
Ordered stir fried udon Noodles for main course. Although a bit oily, it was tasty, full of vegetables ! The dark brownie ordered as desert was mouth watering, the taste lingers.

The staff is courteous and the Vallet very kind and amazing person :)
All in all a good experience !",4,"12 Reviews , 7 Followers",4/15/2019 2:03,6,
The Glass Onion,Prithwish Basu,Great food. Reasonably priced and situated in good location. Had lamb and pasta. Quality and quantity was great. We did not have to wait more than 10 minutes for the food. People coming for lunch would enjoy the Golf course view. A must try for foodies.,5,"3 Reviews , 2 Followers",4/14/2019 20:44,2,
The Glass Onion,Rohit Goyal,With the view of Golf Course and Selection between Wide variety of delicious dishes... This is one of the Best place to Hang Out... Perfect for a sunset view as well...,5,"4 Reviews , 10 Followers",4/14/2019 16:03,3,
The Glass Onion,Ankita Dixit,"Beautiful indoor and outdoor sitting, delicious food
We ordered Ravioli pasta (which was a show stopper)
Nachos, pizza and few of their mocktails.
Everything was just perfect , infact I have been to this place earlier and have to say they never disappoint. 👍 A big thumbs up. Only down vote, for the place being a bit pricy. Would rate it as 4.5",4,"36 Reviews , 111 Followers",4/14/2019 14:35,3,
The Glass Onion,Sumeeth Varma,"If you are searching for a place with great ambience, golf course view with a pleasent sit out area then this place is a perfect match. We had non veg platter, veg platter , classic chicken burger ( this tasted yum), pathari ghosh, bangok spicy rice bowl non veg ( interesting and a tasty treat) however there are fewer options for veg and menu can be improved.

Mocktails very not upto mark and definetly not worth the amount you pay for any of those options as were any other items so please note that its a pricey affair. Service was as usual nothing much to be praised about. Overall

Food & Drinks : 3/5
Ambience : 5/5
Service : 4/5",4,"43 Reviews , 58 Followers",4/14/2019 12:37,7,
The Glass Onion,Himika Saha,"It's a must try place in Hyderabad. Located in boulder hills, this place is spacious and has a golf course in vicinity. The USP of the place is definitely the ambience. The large open area and also the pricey bar counter stacked with expensive liquor. Ideal place for a romantic candlelit dinner. The place reverberates the screech of birds at night and the experience is surreal. We ordered pizza and chicken wings and a couple of drinks. Food was average but the ambience is mind blowing",4,"7 Reviews , 12 Followers",4/12/2019 22:57,0,
The Glass Onion,Atreyee Ray,"Amazing place. Spent a lovely evening here. the apple pie is really good, a must try. Korean waffles are nice too. Nice food, great ambience and great service. 😄",5,"4 Reviews , 105 Followers",4/12/2019 22:00,0,
The Glass Onion,Vipul Maheshwari,"Awesome Place, Great View in love with the Place. Thin Crust Pizzas are great, curry combos are good but not sufficient even for 1 person. Great place to chill out.",5,"4 Reviews , 13 Followers",4/12/2019 13:23,0,
The Glass Onion,Rohit Pareek,"Tasty food, nice ambience, courteous staff. But zomato gold offers are not honored half of the times, depending on their mood. Service could be faster.",1,"3 Reviews , 3 Followers",4/8/2019 21:14,0,
The Glass Onion,Vineet,Super food and fantastic service by Vishal. He was extremely courteous and helpful. The ambience of the restaurant was out of the world . Very serene.,5,"3 Reviews , 5 Followers",4/6/2019 23:03,0,
The Glass Onion,Aditya ReDdy,"It was a busy day which turned into an unplanned dinner at this place. I reserved a table for us on the same day itself. To start with i really liked the ambience of this place and the view which it had. I was delighted to see the place at first. Contrarily i was dissapointed as there were initially no one to recieve us (after reserving the table) and then we ourselves had to ask the management to set up the table for us, as expected every other waiter was in a hurry and they set up an eneven table for us in a shabby manner (like local restraunts) and they gave us the menu. The waiter had no idea abt the dishes and its contents, we asked abt a starter which was made of lotus stem for which he just nodded his head for watever we said. I would say the food was not really upto the mark and the prices were on the higher side, the food was not worth the price, it tasted more like any other local restraunt. The starters being prawns and another vej starter which was made of lotus stem were below average. Coming to the main course we had ordered the butter chicken curry with rice. I would say the butter chicken tasted very bland, it was sweet and barely had any flavour, seemed like they just boiled the chicken in a sause and got it for us, overall a bad experience.




verdict - on the face of it,the ambience was nice, the service and food were not upto the mark. Very dissappointing indeed.",1,"4 Reviews , 38 Followers",4/6/2019 21:26,0,
The Glass Onion,Shivam Agarwal,"When I entered the place I was impressed with the interiors and how huge the place was. What I really liked about the place was that it has a good veg menu as well. We had ordered for a Mac n Cheese Steak. I felt all the items on the plate were dry items be it the grilled vegetables or the Patty or The Pulao Rice, there should’ve been some kind of gravy or dip with these items or else the dish tasted good. We had also ordered for a Spaghetti Aglio Olio. So the Spaghetti that they serve here is wheat spaghetti we didn’t really like how it tasted. When we informed the management about the Spaghetti, they immediately changed it with Spinach Ravioli. The Ravioli tasted really nice, the rich garlic flavour of this dish with pine nuts was a perfect blend.

Over all the experience was a really nice. Definitely a must visit.",4,"11 Reviews , 191 Followers",4/4/2019 10:07,1,
The Glass Onion,Shashidhar Reddy,"Ambience - 5/5 one of the best in Hyderabad, being next to golf course.

Food -3/5 can improve a lot on the taste. Ordered waffle fries, beer fish strips, double pepper lamb, four square pizza. Except for lamb none tasted great.

Service - 5/5 timely, courteous. No complaints.

U can get nice pictures :)",4,"5 Reviews , 12 Followers",4/2/2019 19:26,1,
The Glass Onion,Rhythma Raina,"Let me start the review by complementing the owners for a catchy name ,'The Glass Onion'.
Great ambience, okay food and a mesmerising view and a perfect place to take someone out on a date.

Ambience 4.9/5
Food 3.5/5

Overall: 4.5/5

P.S: You will never regret visiting this place even if you don't like the food.;)",4,"12 Reviews , 27 Followers",4/2/2019 17:24,0,
The Glass Onion,Hungry Soul,"Vegetarian Review ~

Hopped in on a day before Holi for dinner and unfortunately it was a dry day. Survived with food that day. It's on the road to isb and is spread on a huge area with both outdoor and indoor seating arrangements while is outdoor has the view of the golf course and if the weather is great, this is the best place to be. Light music playing through the night was soothing.

We ordered lotus stem galouti with cheese kulcha, Korean waffle fries, veg penne Alfredo pasta and apple pie.

Lotus stem galouti - The galouti tasted great with the flavours of Vegetables and didn't taste much of lotus stem and went well with green chutney and cheese kulcha.

Waffle fries - The waffle had lot of honey, sesame and soy and garlic with a burnt taste. The waffle wasn't crispy and the didn't wasn't that great for my taste buds.

Alfredo pasta - The pasta was creamy and had all the veggies, the consistency was good and it tasted well overall.

Apple pie - This was star of the night for me with the pie tasted great with the falvours of apple and cardamom and the icecream was cheery on the cake and the whole dessert was mouth watering and heart filling.

The staff is good and friendly, I remember being the last one to exit and they were still nice. Keep up the good service. The whole order was around 1400 bucks which is a bit expensive for without alcohol but you get a dining experience and embience so good.

Overall a great place for some drinks and great conversation. Ideal for romantic dates and celebrations. The whole embience is calm and peaceful and makes it best among all @theglassonion",4,"175 Reviews , 1302 Followers",4/2/2019 10:57,7,
The Glass Onion,Rishita Mukherjee,Great ambience. Very good service. Its a great place to go out with dates or family. As it is situated outside the place is quite peaceful too.,4,"16 Reviews , 191 Followers",4/1/2019 20:43,0,
The Glass Onion,Aayushi Sinha,Great place! Great staff! Great ambience! Best place for a nice Sunday brunch with friends and family. It's amazing for dinners too! Do try out the Indian cuisine!,5,"1 Review , 51 Followers",3/30/2019 23:20,0,
The Glass Onion,Ritika Trivedi,"Ambience 5/5 .. this place probably has one of the best ambience in town.
Service : exemplary 5/5 prompt courteous and polite
Relaxing and serene
Food is good
Kebab platter was nice . The cottage cheese could have better.
Liked the cottage cheese steak.
Nice blend of flavours.
Overall a nice place to visit to relax",4,"32 Reviews , 16 Followers",3/30/2019 22:59,0,
The Glass Onion,The Walking Glutton,"Went for lunch along with my colleagues and ordered Salad, Lasagna, Chicken Pan Fried Noodles with Black Bean Sauce and Tiramisu.
Service was average standard, in terms of food the only thing I like was the Chicken Pan Fried Noodles as it had my favourite Black Bean Sauce.",2,"127 Reviews , 552 Followers",3/30/2019 22:34,4,
The Glass Onion,Vishal Goel,Place needs better staff. Food is good and lots of options. People who take orders are not the type for this level of formal restaurant. Food was above average. Won’t repeat it again,1,"23 Reviews , 90 Followers",3/30/2019 21:54,0,
The Glass Onion,Srikanth Nagumalli,"Had good food, good place to hang out with Friends, service was good. Fabulous view of Boulder Hills Golf Club. Calm place within the most busiest Hyderabad's Financial district",4,"1 Review , 5 Followers",3/30/2019 16:00,0,
The Glass Onion,Sriram Reddy,Bit expensive for taste but worth for ambience and hospitality. One of the best venue for office parties and close to corporate offices around financial district.,5,"10 Reviews , 8 Followers",3/30/2019 2:18,0,
The Glass Onion,Alfred Jerome Lazarus,Anoop was really a great host. The ambience is lovely and the drinks are worth. Try the flaming Lamborghini and the lit without ice if you wanna get high.,5,"5 Reviews , 57 Followers",3/29/2019 21:25,0,
The Glass Onion,Vishal,MR.Sonai ur service and food was crazy along with your ambience.! Loved the TSC.!! The Ipl streaming makes it even a better place to chill out with friends and family,5,"8 Reviews , 5 Followers",3/28/2019 23:31,0,
The Glass Onion,Surya G,The ambience inside is cool and outside seating has nice view with golf court but only at nights. The menu has some good options. We liked double pepper lamb and non veg mezzeh platter. Staff was polite but bit lack of knowledge.,4,9 Reviews,3/28/2019 18:48,0,
The Glass Onion,Rahul Reddy,"The Glass Onion, hope it belongs to Global by what I've seen there. This place is built located exactly beside a Golf Course. The inside is just neat and calm. The food served is as good as their service. A calm alcoholic evening spent there is just astonishingly peaceful in the middle of the busy IT hub.",4,"3 Reviews , 110 Followers",3/28/2019 16:19,0,
The Glass Onion,Manasa Redi,"I have been to this for Saturday night dinner. The ambiance and the locality makes it a pleasant sit out with lush greens and golf court all around. The only thing which disappointed me is the service, which was very very slow and the response was not up to the mark.",3,"25 Reviews , 47 Followers",3/24/2019 23:02,0,
The Glass Onion,Gopal Bhargav,"Ambience is great, so is the food. Service is very fast. Serving people are very polite and are easily approachable. Food taste is great. Their location in Zomato is showing incorrect. It would be good if there are some directions put up on the road, it was not easy to find through the map. I would definitely visit again.",4,"47 Reviews , 320 Followers",3/24/2019 22:27,0,
The Glass Onion,Ananth Popuri,"Beautiful place to visit, perfect for a date to go with ur girlfriend. Staff is friendly and very patient when it come to explaining items in the menu. I have ordered waffles, pasta and noodles. Waffles and Pasta(white sause Alfredo) are delicious. One of the best pasta I have ever eaten till now. Noodles are okish. The wine collection is nice and they have all the whiskeys available and prices are also decent.",5,"12 Reviews , 4 Followers",3/24/2019 11:23,1,
The Glass Onion,Renu Singh,"Lovely ambience, good food, and very good service. Sanai waited on us and was very attentive and helpful.
Even on a warm summer evening the outdoor seating was a great experience as it was breezy and serene.
Loved the Bangkok spicy bowl. Chicken burger for the kids was strictly ok. Mezze platter was not bad.",5,"1 Review , 4 Followers",3/21/2019 21:45,0,
The Glass Onion,Raashi Jain,Glass onion is without doubt one of the places to eat at. Not only is the food amazing but the ambience is superb too. Friendly staff and good service . Check out the page s.t.a.s.h on Instagram for a detailed description .,5,"5 Reviews , 16 Followers",3/21/2019 18:12,0,
The Glass Onion,Mishra1mayank,"Extremely poor service and the staff denied the Gold benefits on the table. Overall not a recommended place at all, unless one wants to enjoy the location.

Summary - Location - 100%. Food - 75%. Service - 30%. Gold Membership- 0%",1,1 Review,3/20/2019 12:29,0,
The Glass Onion,Shubhangi Gautam,"I had heard a lot about Glass Onion, but came back extremely disappointed. The only reason I've given it 2 stars is because of the nice staff and the gorgeous ambience. The food is over priced and the quantity they give us is way too less. We ordered the lamb lasagna and we literally had ONE piece of lasagna which really shocked me. Then we had the chicken steak which was decent - nothing special. We gave up on their main courses so went straight to desserts. We ordered the warm apple pie, cheesecake, and the Brazilian chocolate cremeux. The chocolate dessert tasted old, the cheesecake was a thin slice of sadness, but the warm apple pie was very good. Overall, never coming here again and don't recommend to anyone",2,"24 Reviews , 284 Followers",3/18/2019 12:50,0,
The Glass Onion,Nikita Khare,"This is place has good ambience and great variety of drinks considering cocktails and other acoholic drinks. But the food is a bit over priced and quantity is less.

Ambience 8/10
Variety 8/10
Food taste 7/10
Quantity 6.5 /10
Service 8/10
Overall 7 /10",3,"18 Reviews , 48 Followers",3/17/2019 23:15,7,
The Glass Onion,Sayan Roy,This place has an amazing ambience with very professional and premium service. Food is as well good and relishing. It's an amazing place to hangout with friends and family. Also can be considered for a dinner date. Very highly impressed.,5,"36 Reviews , 185 Followers",3/17/2019 20:57,2,
The Glass Onion,Priya Vyas,"We went there to celebrate my husband's birthday given the ratings we saw. However the restaurant did not live up to the high expectations, considering the average food and slow service. The staff was courteous though as we did not like our tomato soup, and they were prompt enough to take it back. Honestly, the replaced one wasn't much of a relief either. Would recommend there to go for the evening view with friends for few drinks, but don't expect mu h beyond that!",3,"10 Reviews , 45 Followers",3/16/2019 21:54,0,
The Glass Onion,Sai Krishna,"This was a fantastic place to go the outer view of this place with golf course was marvelous, hospitality was good and every attendant informed about their food well
It was nice experience going there and especially their noodle bowls are awesome",5,"3 Reviews , 55 Followers",3/16/2019 15:55,0,
The Glass Onion,Apantham,"This is relatively new place. Glass onion has a good ambiance and surroundings. Tried pasta , grilled chicken and couple of other starters.. service is very slow .. otherwise a good place and priced well",4,"27 Reviews , 14 Followers",3/15/2019 17:27,2,
The Glass Onion,Siju,"Went here for lunch on a weekday with less crowd. Still pathetic service. Awful food. It took almost 20 min for the food to arrive. Another 20 min for even the bill to arrive.
Not recommended. Avoid it.",1,3 Reviews,3/15/2019 14:37,0,
The Glass Onion,Jyothireddy.mj,"Beautiful place. It is a best place to go. If your looking for a guite evening. An open golf course on view.
The food is amazing,Soothing music,Lovely ambience and highly recommend for continental and tandoori cuisine.
Service was slow for us.
But it is cool n clam place.",5,"8 Reviews , 6 Followers",3/14/2019 22:37,1,
The Glass Onion,Prasun Gokhlani,"Went here for the first time and the place didn't disappoint. Would love to see more seating places on the outside in the open. Great food and lovely ambience, a must visit !!",4,"25 Reviews , 5 Followers",3/12/2019 17:08,0,
The Glass Onion,Satya Kalluri,"The ambience is nothing but awesome. Even on a summer evening, the breeze alone can make it a worthy visit.
The food is good, haven’t really experimented much - so wouldn’t comment. Loved the drinks, they have a good variety to offer than other ones.
The lighting, music, seating - fantastic.",5,"22 Reviews , 70 Followers",3/11/2019 1:15,0,
The Glass Onion,Lasya M,"We went as a group of 5 on a saturday night.
The ambiance and decor was good. Mosquito filled.

We had ordered
3mushroom soup : decent
Margarita pizza: we asked for a slight customization but sss not adhered to but given his own will on it
Quinnoa chat : surprisingly different and nice
Battered fish : decent
Kun pao chicken: succulent meat ... done well
Teriyaki mushroom: tasted more sour than like teriyaki
Borcolli kababs : melt in the mouth
Noodles were done well
Lamb in lemon butter sauce : i think a wrong dish of lamb was served
Cheese cake : done well..
Apple pie : okayish

All in all the food was decent but the service was pathetic.
We moved from outside to inside ac due to mosquitos and the rooms were also mosquito filled .. when asked he bluntly cited that there is nothing they could do.

The staff have no clue of the menu. Also food is not served in time, the lamb came 20 minutes after we finished rest of the maincourse.

Food : 3/5
Ambience: 3.5 / 5 it would have been a straight 5 if mosquitoes were dealt with
VFM : 3/5
Service : 0",2,"3 Reviews , 104 Followers",3/10/2019 1:27,0,
The Glass Onion,Anil Kumar Ippili,Place is good. food is awesome.. Had Roasted chicken sandwich it is too good. Brownie was also good.ambience Is good.....friendly staff and good service,4,"6 Reviews , 9 Followers",3/8/2019 21:46,0,
The Glass Onion,Shivani_goyal@yahoo.com,"Unique location with tranquil seating outside.
Food is very average despite being fusion 9 offshoot.
Drinks average plus. Overall didn’t understand the hype",3,"3 Reviews , 1 Follower",3/7/2019 0:34,0,
The Glass Onion,Neeraj Ramani,"Well randomly searching for a restaurant in gachibowli area, we stumbled upon The Glass Onion.And what a lucky choice it was. Right from the entrance, the ambience vows you. The English decor, the taste and the service, everything was second to none. We tried a butter chicken platter and it was delicious. Especially the black dal was awesome.",5,"4 Reviews , 2 Followers",3/6/2019 12:39,0,
The Glass Onion,Aditya Jain,"Food and service everything is good. But not able to avail zomato gold at the end of dining. Vishal, Srikanth manager and vishawanath waiter everybody befooled that we can use zomato gold at the end but then it gets closed.",1,"3 Reviews , 198 Followers",3/5/2019 23:40,0,
The Glass Onion,Shashank Karukonda,"The service is shit, the waiter asked us not avail Zomato gold at the beginning of the order but to avail at the bill time. But gold was not available but to compensate no discount was given ... disappointing experience",1,"2 Reviews , 2 Followers",3/5/2019 23:35,0,
