Restaurant,Reviewer,Review,Rating,Metadata,Time,Pictures,7514
Zing's Northeast Kitchen,Sourav Datta,"An awesome foodie experience that takes you telepathically to the kitchens of North East India. Will come here again and again for the taste of their food if not for anything else.

Food: 4/5 The pork dishes are awesome and the noodles were delicious. This is one place where though your stomach is full your heart wants more. Only thing I do not like is the noodle that they use. Feels like instant noddles and I feel this could be better.

Service: 3/5 Service is very slow. They seem to be a family run restaurant and sometimes (which is more often than not) when they are busy Service can be very slow. They have to very soon hire some more helping hand if they continue to experience this much of demand.

Ambiance :  3.5/5 Simple and minimalist interiors of a north eastern roadside joint.

Price : 4/5 Pretty decently priced for the quality and taste that they offer. It is really a steal deal.",4,"78 Reviews , 1612 Followers",11/15/2018 20:15,4,
Zing's Northeast Kitchen,Debasmita Ghosh,"An extremely accessible joint situated on the main road with a pretty good variety of north east cuisine and a polite bunch of staff. We planned to try anything but options in pork so we ordered pork belly with veggies n kimchi salad. The particular dish is supposed to be consumed is a unique fashion. The pork belly, veggies and kimchi are to be placed on the lettuce leaf and wrapped. This combination is delicious and you would love it. Next we had smoked pork ribs which i assume had barbecue sauce and sesame seeds and tastes pretty soft tender and yum. The beef curry and steamed rice was decent but extremely spicy. You can specify how spicy you want your dish and they can suggest or customise their dishes.
Ambience is nothing but ordinary and it draws a decent crowd even on weekdays.
But i would definitely go back to try the other delicacies. Do visit and indulge into their menu.",4,"74 Reviews , 64 Followers",11/15/2018 12:06,0,
Zing's Northeast Kitchen,Kunal Khanra,"I have been looking for good porks in Hyderabad.. n finally found it . Pocket friendly and delicious food you would find over here. Right opposite to SLN terminus, quick service, decent interior and courteous manner! Pork ribs, beef curry chicken momo..the list goes on! Don't miss this place ..",5,"189 Reviews , 2860 Followers",11/14/2018 23:22,3,
Zing's Northeast Kitchen,Lisa Saikia,"I visited this place once and oh my oh my lemme tell you, this place is ahmaaazing! The food was amazing. We ordered pork and it tasted so good, just melted in my mouth. I am salivating just by thinking about it. Maybe there was just a little extra soy sauce in the food but however it was, it was really good! Highly recommended! Will visit soon. Chompchompchomp!",5,"25 Reviews , 5 Followers",11/14/2018 18:02,0,
Zing's Northeast Kitchen,Arpit Sahai,"Though understaffed, this place is really a treat for someone who is not used to North Eastern food. I took few of my friends for a treat and ordered multiple items out of which pork ribs and teriyaki chicken turned out to be amazing. Keep up the good work!",5,2 Reviews,11/13/2018 21:55,0,
Zing's Northeast Kitchen,Ritoban Bhattacharya,"If u wanna try good pork in Hyderabad then this is the place, love the pork dishes from starters to main course. Staffs are well behaved & food is not expensive as well. A must visit for pork lovers👍",5,"3 Reviews , 40 Followers",11/13/2018 9:20,0,
Zing's Northeast Kitchen,Jersha Grace,The food is amazing! Easily one of the best pork dishes I have had in Hyderabad. The restaurant set up is like a cozy little shack and this along with the food transports you to another place entirely. I'm gonna become a regular here!!!,5,"3 Reviews , 4 Followers",11/11/2018 18:40,2,
Zing's Northeast Kitchen,Aparajita Chowdhury,"We went on a weekend to this place as we had been wanting to try out this new place in town for a while.

Starting of with the pros, the decor and ambiance of this place is really good. The menu is quite interesting too, and includes a variety of chicken, pork, beef and some fish dishes. There are a few vegetarian options, but I do not know to what extent it would satisfy a vegetarian. They have a good choice of mocktails as well, and each one was really good. The pork ribs and the mushrooms were good too. The staff there was good too.

Moving on to why I chose to give this a bad review- first of all, the service was really slow. Took about an hour for my food to arrive. Moreover, my chicken noodles tasted exactly like Maggie with a few chicken pieces thrown in. I had attached a picture of it for reference. Moreover the portion sizes are quite small in relation to the price of the dishes. A small bowl of beef curry was 200 and one plate of steamed rice was not even enough for two people. Even though the taste was good, because of the portion sizes and the relative prices plus the service time our experience was ruined.
Hence the two stars.",2,"14 Reviews , 11 Followers",11/11/2018 10:02,1,
Zing's Northeast Kitchen,SUPRIYO DEBNATH,"So yeah, let's start the reviewing part.
1. Costly place and not much appreciated for students.
2. Service is really very slow.
3. Quantity is not much appreciated but kinda okay but not all dishes.
4. They had less staff.

So done with the negative part and the positive thing is that you get to have pork there which is rare in this area and the food is not that great but kinda okay. If you wanna try something new and also spend some extra bucks then go for it. Not much of a satisfactory feeling here. 2 stars for the delays and less quantity of food in fat ass price. Happy dining.",2,"1 Review , 1 Follower",11/11/2018 9:51,0,
Zing's Northeast Kitchen,Pratik Kundu,"Sad experience at Zing's after hearing so raving reviews about this place. Folks at the restaurant were least bothered in taking our order right since we sat down on an empty table. Half of the food items on the menu weren't available, maybe they need to shorten the menu just to include items that are available round the clock. We had ordered pork with bamboo shoot, which I have had quite a lot of time at my hometown (Siliguri), unfortunately, this wasn't nearly as good as I had before. Although I won't judge the restaurant based on just this item, as chances are it was a one off case. But the service and staff attitude was a real put off. I had very high hopes, but was completely let down. Something seemed to be very off, as a restaurant having 4.6 rating usually won't come across this way. Either my bad day, or the chef's.",1,"11 Reviews , 136 Followers",11/10/2018 23:05,0,
Zing's Northeast Kitchen,Srinjoy Roy,"It's authentic!
It's delicious!
It's a must visit!
I visited the place two times and it seems to get better every time. The food is very good and the staff is extremely polite and friendly!!",5,"43 Reviews , 77 Followers",11/10/2018 21:51,3,
Zing's Northeast Kitchen,Ramona Sinha,"This is a small joint for those who love north eastern food. It's just opposite to SLN terminus. I usually have chicken momos from this place as i love it. But this time i also ordered chicken teriyaki bowl. The quantity was a little less and taste-wise it was okayish. The ambience of this place is quite good but the service is a bit slow. I will be trying out other food items as well and accordingly I will update my review. Overall, i liked the place.",4,"34 Reviews , 77 Followers",11/10/2018 18:51,0,
Zing's Northeast Kitchen,Diandeh Nath,"Tried smoked pork with bamboo shoot and ghost chilly and chicken momos. A perfect blend of everything.
Best chicken momos in all of Hyderabad .

Affordable price and great food",5,"16 Reviews , 40 Followers",11/8/2018 11:00,0,
