Restaurant,Reviewer,Review,Rating,Metadata,Time,Pictures,7514
Zing's Northeast Kitchen,Narresh Tellakulla,"Been here with friends for lunch, the moment we entered in to the restaurant you will feel as if your in some eastern states. we ordered drumsticks, chicken teriyaki and OM chicken rice. The drumsticks were good with sauce and best part was chicken teriyaki it was delicious and tasty and the OM rice was okay. Overall food was good and service was okay.",3,"12 Reviews , 5 Followers",2/2/2019 13:11,3,
Zing's Northeast Kitchen,Shivi Saxena,"I read a lot of reviews about this place before visiting, most of them read that the service is very slow. I only realised it after I went there.
I was so tired waiting for my food that I only had starters here and went to some other place for dinner.
Food was no wonder very tasty.

We ordered drums of heaven and pork belly in chilly sauce. It all tasted really nice.

I hope the place works on their service.",3,"168 Reviews , 427 Followers",1/30/2019 8:27,2,
Zing's Northeast Kitchen,Teboihi Hrahsel,I have been here many times....The food are really delicious and nice place...Staff are good and friendly as well....but one thing food used to pending and waited for so long...So you have to get more improve deliver food on the table and not letting them wait for so long.....Thank you for give us apportunity to have the good food.,5,2 Reviews,1/29/2019 16:09,0,
Zing's Northeast Kitchen,Saran Raparthy,"Had been there today with the reviews seen here. Food was below average. We ordered lemon grass chicken , 2 pork dishes, Naga chicken curry, butter garlic prawns, chicken raymun noodles. Out of all this lemon grass chicken n pork never came to our table. Staff are very very slow very dumb very very poor service. Forgot half of the items even after writing down. Guys just be prepared each dish takes a minimum of 30mins for it to arrive at your table. Never going here again.",1,"14 Reviews , 66 Followers",1/27/2019 16:41,0,
Zing's Northeast Kitchen,Reshma Gupta,"Very late order..he forgot half of the food that I ordered..had to keep reminding...the staffs are not friendly at all.they don't even talk to you straight face,not polite, do not visit",1,"3 Reviews , 79 Followers",1/27/2019 15:41,0,
Zing's Northeast Kitchen,Sarvesh Gupta,"It was a bad experience. Worst part was when we entered the places and there was this pathetic smell to welcome us. Another issue, you can't just order anything from the menu because maximum number of items were not available.

The food was smelling too.

I ordered ""Steam Naga Fish"".

If u really want to eat, get a mask(suggestion).",2,"3 Reviews , 4 Followers",1/26/2019 15:24,0,
Zing's Northeast Kitchen,Rohit Chakraborty,Best restaurant if you are looking for authentic Naga food away from north east I would recommend everyone to try here at least once thanks you guys for bringing this in Zomato too,5,"2 Reviews , 3 Followers",1/24/2019 15:02,0,
Zing's Northeast Kitchen,Jujit Saikia,"If you live anywhere in Hyderabad and you love eating pork and beef, then this is a good place to try. None of the dishes contains masala. And the chutney given as complimentary with the main course is worth trying though it is very very spicy because of the BHOOT JOLOKIA. Happy feasting:)",5,"7 Reviews , 223 Followers",1/23/2019 20:30,0,
Zing's Northeast Kitchen,Sarthak Bajaj,"The staff is a little less knowledgeable and understanding when it comes to explaining the dishes, they don't have anything for a vegetarian guest ( we had one vegetarian friend in a group of 10 who starved )

They restaurant smells for the raw meat from the kitchen.

The mocktails are good, the pork is mid rare and juicy, however the chicken is not that good.",3,"44 Reviews , 208 Followers",1/21/2019 18:15,0,
Zing's Northeast Kitchen,An Urag Yonzon,"I had a good experience .
This was my first time in zings northeast kitchen.
The starters were good .
But I was disappointed when I got two of my orders not available.
Next time when I visit I would love to have those starters too .
Lots of love .
Thank you .",5,1 Review,1/20/2019 23:30,0,
Zing's Northeast Kitchen,Gopika Padmakumar,"The food was excellent. I took one star off just because the staff behaviour could be improved. If you love North eastern cuisine and southeast asian cuisine, a must try.",4,"2 Reviews , 1 Follower",1/20/2019 20:07,0,
Zing's Northeast Kitchen,Medha Parashar,"First of all they dint have main dish for which i went... Bibimbap and kimbap.. But still i got teteiyaki chicken and noodles. Sweet and simple place with pretty cozy ambience. People who serve food are very friendly but there were only 2 people who were serving food so our order came really late. Place is really famous so people were even waiting outside for seats.
Tip: please call them beforehand if you are specially looking for Bibimbap..",3,"24 Reviews , 8 Followers",1/19/2019 22:56,0,
Zing's Northeast Kitchen,Sumit,"Such a disappointing visit. Went at around 7.30 p.m. Menu was given having lot of options to choose from. Beef, Pork, Chicken, Fish, Veg. I don't eat Pork and Beef so asked for Chicken Momo: NOT AVAILABLE Veg Momo: NOT AVAILABLE Mung Tang (fish item): NOT AVAILABLE Full Steam Fish: NOT AVAILABLE.
I walked out of the place without having anything.",1,"401 Reviews , 2736 Followers",1/17/2019 22:19,1,
Zing's Northeast Kitchen,Veggie-Lover,"First things first:
Decent food. Average Service. Affordable pricing. Big on non vegetarian delicacies.

Small place with cute interiors serves up some mouth watering momos, bruschetta and Ramen.
Good things take time, especially if it’s a newbie kitchen trying to serve you food. Be patient. The service is slow but the food is good.

If you’re looking for a bowl of north Eastern style of Ramen, try their version of it. Simple, soupy and well spiced. It’s a bowl of comfort. Let’s not get your hopes high just yet. It’s their version of it and not an attempt to mimic the classic ramen that is usually popular otherwise.

The momos are good, soft and melt in the mouth- must try. They run out of the vegetarian ones rather soon.


Overall it’s a small place. Give it time, nurture it. Go for the experience.",3,"96 Reviews , 1069 Followers",1/17/2019 21:02,3,
Zing's Northeast Kitchen,Vasudev Singh,"Hard to get hold of their attention. After a number of visits I now have come to terms that, it  usually takes 10-15 mins for them to come tend to you. Heck even a glass of water takes time to come to the table. Service needs to get better ! 

Anyways coming to the food, a great place for most things pork. My favorite dish which is something I totally gorge over is the Bosam. Nicely sliced pieces of pork belly, kimchi and tender pices of chillies. Each bite is a bliss. The kimchi pork fried rice is good too though I wish they could improve upon the quantity of pork in the dish.",3,"37 Reviews , 304 Followers",1/17/2019 16:43,0,
Zing's Northeast Kitchen,Duggu,"My 1st visit to the place for lunch and i enjoyed their food.
We ordered lemongrass chicken it was nice but not strong lemon grass flavor though. But the chicken stew with rice was awesome, it was very light yet very flavor full. I will surely visit this place again to try their Korean menu. #foodlove",4,"55 Reviews , 1299 Followers",1/15/2019 11:09,1,
Zing's Northeast Kitchen,Rajat Goel ✳️,"Having heard a lot of hype surrounding this place, and the 4.5 rating on Zomato, it was on my wishlist for ages, but I was always skeptical of the taste, being too authentic and a totally new cuisine. The former proved to be true, and was the primary reason I didn't have a very pleasing dinner.

It's a small and cute little diner like Cafe, with minimalistic and soothing interiors. The sour smell of fermentation was nauseating initially, but I got used to it in just a few minutes. Some room freshener would do the trick.

The items are priced very cheap, I had high expectations, but only to learn later the portions are just too small. We had:

🍗 SPICY DRUMS OF HEAVEN (140/5) - The only thing I could properly finish. A typical batter fried chicken. Almost south Indian and spicy in taste, but the coating was too thick.

🍗 CHICKEN SUCCULENT YAKITORI (130) - 3 skewers with tiny chicken chunks, spring onion stem and a sesame seed drizzle. Texture was good, but taste, average. Sticky barbeque sauce coating it felt like.

🍗 CHICKEN MOMOS (130/5) - Standard, good amount of filling, with a very pungent ginger flavor. The coating was thick too. Chilli chutney served alongside was not too spicy, and went well with the Momos.

🐽 BOSAM (170) - It was my first time trying pork belly, and I can't really judge, but it felt fatty and gooey. The pieces were drenched in grease. Served with spicy kimchi which I loved.

🍜 CHICKEN RAMYUM NOODLES (180) - Big bowl of noodles, what looked like Maggi but was only a close resemblance. Scarce chicken pieces, undercooked, dry and hard noodles, and overall a very bland taste.

🐟 NAGA STEAM FISH (250) - This was the thing causing the smell in the restaurant. And I couldn't tolerate it. A very very pungent and strong odor. The fish had a great texture and was steamed to perfection. Served with steamed white rice.

Whatever I mentioned about the food, was just my impression, and maybe because it was the first time trying out this new cuisine, I didn't really like it.

However, one thing that was disappointing was the service. It was slow and just took ages. Once the food arrived, it was fine but again the bill took more than 20 minutes.

As many others have already said, I guess, the strong point of this place is their pork preparations, and I would recommend this place purely for that. An elaborate menu with lots of options, priced well.

Here's my overall SCORE:
Food - 3.5/5 (not judging what I tried first time/don't know about)
Ambience - 4/5 (get a room freshener!)
Service - 3/5
VFM - 4/5",4,"148 Reviews , 3383 Followers",1/15/2019 1:07,8,
Zing's Northeast Kitchen,Oindrila Dutta,I would give a negative star if possible for their hygiene and service. We ordered our food at 9:30PM and after an hour's wait they come and say that what we ordered from the menu isn't available. We had to order something else and wait for another 30mins and then to my surprise I found HAIR in the food! So in short it a was a terrible experience.,1,"6 Reviews , 2 Followers",1/14/2019 13:35,0,
Zing's Northeast Kitchen,Anvesh Alluri,"Had a lot of expectations after checking out the positive reviews for Zing's. There was some weird smell when we entered the outlet which was a bummer. We asked for momos which were not available. So we got lemongrass chicken and the portion size was very disappointing and shocking. Drums of heaven was another appetizer that we ordered which was below Average. We then ordered Ramyuen noodles which was tasting and looking very similar to maggi. We also got ohm fried rice which was very bland and tomato ketchup was used for presentation. The waiter who took our order looked disinterested. So, I really don't understand what the hype is about. Thumbs down 👎",1,"15 Reviews , 3 Followers",1/8/2019 23:38,0,
Zing's Northeast Kitchen,Nachiketnh,"We had a family dinner at Zing’s with very high expectations considering the ratings. We ordered the following :
Moroccan Eggs - 4/5
Chicken Satay - 2.5/5
Drums of Heaven - 3.5/5

Noodles - 0/5( They were like instant noodles with no tastemaker)
Fried Rice with Omelette - 2/5(Nothing much)
Pork Bimbipop- 3/5 (The only decent thing in the main course.

All in all, it’s not worth the price. We really wanted to like it but were really disappointed.",2,"14 Reviews , 6 Followers",1/6/2019 11:18,0,
Zing's Northeast Kitchen,Sachin Upot,"Had the misfortune of visiting this place on New Years Day. We were given the run around with the table, then it took them 30 mins to take our order only to forget all about it. After an hour of reaching the place we realise the food isn’t even ready.

Not even an apology. Thoroughly disappointed.",1,"27 Reviews , 84 Followers",1/1/2019 22:48,0,
Zing's Northeast Kitchen,Anurag Tej,The food is amazing. Their service needs to improve a lot. 5 stars for tasty food and elaborate menu. The staff was very friendly and can help you with ordering the right dish.,5,"5 Reviews , 3 Followers",1/1/2019 15:18,0,
Zing's Northeast Kitchen,Darshan M Ambat,"The most amazing Naga beef I've ever had. The pork ribs are to die for. The pork belly melted in our mouth. Most of the dishes are tasty as hell.
Portion is kinda small but the price is correct for the portions.
Service is a bit slow. One area they really need to improve is to get more and/or better trained staff.
But the flavor of the food makes up for everything making me give 5 stars.",5,"9 Reviews , 81 Followers",12/29/2018 18:17,0,
Zing's Northeast Kitchen,Deepa Mallick,Love for asian food brought me to this place. This place would accomodate 30 -35 people at once approximately. Food are well made with almost authentic taste. Tried Pork Momos which tasted really good specially the pickle that goes well with momos and you would not find it anywhere else in Hyderabad as per my knowledge. After that we ordered Dotsol Bibimbap which was a colorful food which would please your eyes and ofkorse your savory mouth and fill your stomach for sure (depends how much you eat :P I was full with one bowl) . One more dish that we had ordered was Ramyun Noodle which I felt almost like maggie with a very slight difference but it was soothing and filling. Only thing that had disaapointed me was the late service. We almost had to wait for 40 mins for our food.,4,"6 Reviews , 13 Followers",12/26/2018 17:45,0,
Zing's Northeast Kitchen,Sourav Ghosh,"This tiny joint serves excellent Northeastern & East Asian food. Their Beef Curry with Naga Peppers is heavenly. Deojikalbi was excellent as well. The Beef Soba Noddles was also good, though less so than the other two items. The portion sizes are a little small, but then again the prices are pretty damn cheap as well. The one area where they can improve is the speed & efficiency of service, but since it's fairly new & has a very small staff at this point (possibly family run ?), I'm optimistic that they will improve as they mature.",5,"63 Reviews , 53 Followers",12/26/2018 1:22,0,
Zing's Northeast Kitchen,Foodie Chaudhary,"I seriously didn't understand the buzz around this place. Decided to have Sunday lunch here owing to the good rating of this place. The staff didn't really give any attention and we had to find a table for ourselves.
Many items on the menu were not available even on weekend and we settled for veg clear soup, mushroom & spinach soup to start with. The quantity of soups was a bummer and it was a huge bowl quarter filled with soup. If they plan to serve this quantity then they should switch to smaller bowls to atleast give illusion of a filled bowl. Mushroom & spinach soup tasted like Maggi /Knorr soup and not fresh.
For starters we opted butter pepper garlic prawn. It was served in a small plate with even smaller portion. 5 tiny prawns for starter definitely doesn't justify. The taste was average , better than soup.
For main course we decided Dotsol Bibimbap and Naga Chicken curry. Main course was way better in taste and we really liked Bibimbap. Naga chicken was good in taste but had mostly bones.
The portion size is major disappointment here and its evident across all courses. Another point of concern is their service. Be it taking order, suggesting food or even table service, the staff is not really helpful and takes forever to respond.",2,"118 Reviews , 2042 Followers",12/25/2018 18:51,9,
Zing's Northeast Kitchen,Debdatta Podder,Visited this place with much expectations..but got disappointed with the service and the bad smell inside the restaurant..we ordered chicken momo and lemongrass chicken..chicken momo was very okayish...n after waiting for a long time the owner informed that they need lot more time to make the dish..as we couldn't wait more did not get chance to taste the dish...service needs to be improved..,2,"7 Reviews , 58 Followers",12/22/2018 23:00,0,
Zing's Northeast Kitchen,Debajyoti Das,"Food is awesome and loved the chicken momo and the chicken noodles. Good authentic food, a must visit for any momo and noodle love. However expect a delay in service.",5,"2 Reviews , 94 Followers",12/22/2018 22:23,0,
Zing's Northeast Kitchen,Eeha Ashok,"One of the very few places that I tried North eastern food. The place has a cosy setup with interiors and cutlery that totally go with the theme of the place.

We ordered a teriyaki chicken bowl, Ramyan noodles, bruschetta and Doenjang Jjigae. We absolutely loved the Jjigae, which is similar to a vegetable stew and absolutely rich with flavours. The teriyaki bowl and noodles were definitely above average. They served the teriyaki bowl with sautéed spinach on the sides, perhaps more vegetables would have been better. All in all a great experience!",4,"43 Reviews , 107 Followers",12/22/2018 4:52,2,
Zing's Northeast Kitchen,Syed Zeeshan,"Bad experience when ordered food from here. Prices looked very reasonable while ordering, and literally the quantity was very less. They should be mentioning that if we are ordering Prawns for starters they are giving exactly 6 pieces of them. Very disappointed with that even though the taste is good.",1,"2 Reviews , 1 Follower",12/15/2018 18:03,0,
Zing's Northeast Kitchen,Rupayan Banerjee,"I was pretty excited looking at the 4.6 rating. But quite disappointed. I would rate the food at 4 though. But service is extremely poor. The staff isn't good at recommending dishes. The Beef curry with Naga chilli isn't good, probably because they had overused some condiment giving it a bitter taste. The pork belly was good. Beef fry wasn't great because meat was undercooked. The steam country chicken curry was good.

I would give this restaurant another chance and come back again because I really love the food from the north east and then order something which would be actually good and worth the rating it boasts right now.",3,"11 Reviews , 80 Followers",12/11/2018 22:45,0,
Zing's Northeast Kitchen,Sahiti B,"Cute little place with GREAT food and superb presentation. The interiors are simple and pleasant. The place is very neatly maintained and appears hygienic.
This place is just walkable from my office and it has been my go to place since the time I discovered it.
I love their Garlic Prawns, Chicken Yakitori, Teriyaki chicken, and noodles.",5,"6 Reviews , 3 Followers",12/11/2018 14:21,0,
Zing's Northeast Kitchen,Thomas Premkumar,very low quantity for the price,1,"2 Reviews , 1 Follower",12/9/2018 19:48,0,
Zing's Northeast Kitchen,Somnath,"Hello Guys, This will be honest review. We visited yesterday(7th Dec) as we heard a lot about this restaurant. We had a mixed experience here. When you enter this place, you will definitely feel a bad smell inside. That was really disgusting. We ordered Chicken lollipop, Smoked Pork, Bosam and Ramyun Noodles. Food was awesome except Bosam. We didn't like the taste. So If you want to try Northeast food, surely you can give a try.",3,1 Review,12/8/2018 14:13,2,
Zing's Northeast Kitchen,Sathishchowdary Ng,"Perfect northeast kitchen in the town...
The pork rice is delicious and noodles are good...don't expect a regular noodles...the non alcoholic beers are good
And fries are very good",4,"12 Reviews , 39 Followers",12/7/2018 16:25,3,
Zing's Northeast Kitchen,Manisha Singh,"This is my go to place. I can never get bored of their food and ambience. Happy to see them in Zomato. Food is always great. Love the ramyun noodles and bibimbap. Best time to visit is on weekdays. On weekends, there's too much rush and food orders get delayed. I would suggest to add more items in their menu.",5,"9 Reviews , 71 Followers",12/5/2018 18:11,0,
Zing's Northeast Kitchen,Samrat Basani,"Been here twice in less than a month, and I hope I can keep coming back.

I absolutely love their food. The bibimbap is to die for, and the king chilly pork only slightly less so. Their ice-cream also manages to be excellent.

The service is a bit shifty, but we can't have everything. Unbelievable prices (for now), as well. Definitely go here if you love meat.

Slightly louder music and tea would be great additions, but hardly necessary.",5,"169 Reviews , 841 Followers",12/4/2018 19:59,0,
Zing's Northeast Kitchen,Food Hunters,"This amazing restaurant is not exactly in Gachibowli. It's located between Sarath City Capital and SLN Terminus Mall in Kondapur.

We visited this place when it had just opened and we were surprised with the quality of the food. For starters, we had pork momos. Everything including the presentation was perfect. Beef Soba Noodles and Teriyaki Chicken Rice alongwith Roasted Chilly Lamb and each one was competing with the other for a place in our hearts. The beef had a lovely texture and was well cooked. It was a tad on the bland side but tasted great nevertheless.

The ambience catches your eye and one fails to control the urge to click pictures of the walls. The people are nice, so is the food. You could keep visiting it.",5,"115 Reviews , 547 Followers",12/4/2018 15:26,7,
Zing's Northeast Kitchen,Jennie Clarence,"We were soo excited about the place but somehow not satisfied.. Firstly.. The place was in utter silence.. The ramyun noodles, bosam, butter garlic prawns were all just mediocre and purely serves just 1.. Lack of Salt was felt in some dishes.. Yea but the mock tails were good..",3,"9 Reviews , 7 Followers",12/3/2018 8:56,0,
Zing's Northeast Kitchen,Harika Reddy,"Finally some korean dishes in a restaurent in the city...!! Have tried their
-Bossum(korean lettuce wraps)
-Dwaenjang jigae(soyabean paste gravy with vegetables)
-kalkuksu(plain noodles with chicken)
-Daeji kalbi(porkbelly with ganjang sauce)
-Steam fish naga chili
Everything was soo good...loved the soyabean paste gravy and ssam was pretty good too.Kalkuksu needs more broth to it...it was very dry with little broth...wish they didn't use instant ramen.The serving pots gives life to this place...am visiting this one again for sure.My love for asian and authentic cuisines made me visit this one and it didn't disappoint.",5,"85 Reviews , 673 Followers",12/1/2018 23:18,0,
Zing's Northeast Kitchen,Sai Kiran Bolloju,"Forget the 4 or 5 rating given for this restaurant. This place is crap. I will say except plating, nothing will please your appetite. Customer service, I will give -10. For 15 tables, it a single guy who was taking orders. In between all this, he is also the one who is at bill desk too. Believe me they didn't served water until we are forced to ask for.

Customer service - they don't deserve a rating for it.
Food - 1*",1,"4 Reviews , 26 Followers",12/1/2018 9:59,0,
Zing's Northeast Kitchen,Heavenly Nan,"The restaurant is a nice decent place and pocket friendly too. Food taste good but I personally think there are too much soya sauce mostly in everything .The menu is mainly Korean with very few NE food in their main course section(for people who really want to experience northeastern food I’d suggest that the main course section might be helpful for you). Over all, m happy that I found a place to hop in whenever I feel like having pork or beef.",4,"2 Reviews , 1 Follower",11/29/2018 19:02,0,
Zing's Northeast Kitchen,Arun.geetesh,"It's a fairly simple restaurant, nothing too fancy, with some parking available right in front of restaurant. However the climb is way too steep. Has pork and beef on menu, a great addition to Kondapur. Food is good, portions are small, but that's by Hyderabad standards, otherwise one dish is enough for one adult. We went on a Sunday and we had to wait for close to one hour to get all items ordered, maybe we will try it on a weekday, if waiting time still is that long, it needs serious improvement. Overall a new addition for niche crowd.",4,"4 Reviews , 3 Followers",11/26/2018 11:55,0,
Zing's Northeast Kitchen,Abhishek Sarkar,"Best pocket friendly place in and around Gachibowli if you are a fan of South Korea, and North Eastern cuisine. And, yes there's a lot of love in cooking Korean food and every morsel tastes wonderful. Small place, good range of menu and pocket friendly price. Must try - Smoked Pork Ribs, Pork Bosam , Naga Steamed Fish and Chicken Ramyun Noodles.",4,"122 Reviews , 438 Followers",11/25/2018 16:28,4,
Zing's Northeast Kitchen,Banisree Basu,"I have been waiting to write a review for Zing's north east kitchen for a real long time and I love what they cook n create, it's a little restaurant on the very opposite side of SLN terminus, Gachibowli. The food quality is amazing just feels like home, quantity and the price are reasonable. And I have lost count of the number of visits I made... Strong recommendation for pork and beef lovers 😍",5,"17 Reviews , 378 Followers",11/24/2018 11:59,0,
Zing's Northeast Kitchen,Sohini Ganguly,"For All the Pork lovers now you have an amazing outlet right at Gachibowli....great food , very good staff ...personal care from the owner ...just loved it ....",5,"6 Reviews , 124 Followers",11/22/2018 9:58,0,
